Instruction Information
INST_INFO[ 0 ].value :   1405024
INST_INFO[ 0 ].opcode :  0
INST_INFO[ 0 ].func_code :  36
INST_INFO[ 0 ].rs :  10
INST_INFO[ 0 ].rt :  0
INST_INFO[ 0 ].rd :  10
INST_INFO[ 0 ].shamt :  0
INST_INFO[ 1 ].value :   1605824
INST_INFO[ 1 ].opcode :  0
INST_INFO[ 1 ].func_code :  36
INST_INFO[ 1 ].rs :  11
INST_INFO[ 1 ].rt :  0
INST_INFO[ 1 ].rd :  11
INST_INFO[ 1 ].shamt :  0
INST_INFO[ 2 ].value :  3c081000
INST_INFO[ 2 ].opcode :  15
INST_INFO[ 2 ].rs :  0
INST_INFO[ 2 ].rt :  8
INST_INFO[ 2 ].imm :  4096
INST_INFO[ 3 ].value :  3c091000
INST_INFO[ 3 ].opcode :  15
INST_INFO[ 3 ].rs :  0
INST_INFO[ 3 ].rt :  9
INST_INFO[ 3 ].imm :  4096
INST_INFO[ 4 ].value :  35290004
INST_INFO[ 4 ].opcode :  13
INST_INFO[ 4 ].rs :  9
INST_INFO[ 4 ].rt :  9
INST_INFO[ 4 ].imm :  4
INST_INFO[ 5 ].value :  254a0001
INST_INFO[ 5 ].opcode :  9
INST_INFO[ 5 ].rs :  10
INST_INFO[ 5 ].rt :  10
INST_INFO[ 5 ].imm :  1
INST_INFO[ 6 ].value :     a5040
INST_INFO[ 6 ].opcode :  0
INST_INFO[ 6 ].func_code :  0
INST_INFO[ 6 ].rs :  0
INST_INFO[ 6 ].rt :  10
INST_INFO[ 6 ].rd :  10
INST_INFO[ 6 ].shamt :  1
INST_INFO[ 7 ].value :     b5840
INST_INFO[ 7 ].opcode :  0
INST_INFO[ 7 ].func_code :  0
INST_INFO[ 7 ].rs :  0
INST_INFO[ 7 ].rt :  11
INST_INFO[ 7 ].rd :  11
INST_INFO[ 7 ].shamt :  1
INST_INFO[ 8 ].value :  254a0001
INST_INFO[ 8 ].opcode :  9
INST_INFO[ 8 ].rs :  10
INST_INFO[ 8 ].rt :  10
INST_INFO[ 8 ].imm :  1
INST_INFO[ 9 ].value :  26b5ffe8
INST_INFO[ 9 ].opcode :  9
INST_INFO[ 9 ].rs :  21
INST_INFO[ 9 ].rt :  21
INST_INFO[ 9 ].imm :  -24
INST_INFO[ 10 ].value :  26a30018
INST_INFO[ 10 ].opcode :  9
INST_INFO[ 10 ].rs :  21
INST_INFO[ 10 ].rt :  3
INST_INFO[ 10 ].imm :  24
INST_INFO[ 11 ].value :  22a40018
INST_INFO[ 11 ].opcode :  8
INST_INFO[ 11 ].rs :  21
INST_INFO[ 11 ].rt :  4
INST_INFO[ 11 ].imm :  24
INST_INFO[ 12 ].value :  256b0001
INST_INFO[ 12 ].opcode :  9
INST_INFO[ 12 ].rs :  11
INST_INFO[ 12 ].rt :  11
INST_INFO[ 12 ].imm :  1
INST_INFO[ 13 ].value :   1204825
INST_INFO[ 13 ].opcode :  0
INST_INFO[ 13 ].func_code :  37
INST_INFO[ 13 ].rs :  9
INST_INFO[ 13 ].rt :  0
INST_INFO[ 13 ].rd :  9
INST_INFO[ 13 ].shamt :  0
INST_INFO[ 14 ].value :   24a9023
INST_INFO[ 14 ].opcode :  0
INST_INFO[ 14 ].func_code :  35
INST_INFO[ 14 ].rs :  18
INST_INFO[ 14 ].rt :  10
INST_INFO[ 14 ].rd :  18
INST_INFO[ 14 ].shamt :  0
INST_INFO[ 15 ].value :    119040
INST_INFO[ 15 ].opcode :  0
INST_INFO[ 15 ].func_code :  0
INST_INFO[ 15 ].rs :  0
INST_INFO[ 15 ].rt :  17
INST_INFO[ 15 ].rd :  18
INST_INFO[ 15 ].shamt :  1
INST_INFO[ 16 ].value :    128840
INST_INFO[ 16 ].opcode :  0
INST_INFO[ 16 ].func_code :  0
INST_INFO[ 16 ].rs :  0
INST_INFO[ 16 ].rt :  18
INST_INFO[ 16 ].rd :  17
INST_INFO[ 16 ].shamt :  1
INST_INFO[ 17 ].value :   17f5821
INST_INFO[ 17 ].opcode :  0
INST_INFO[ 17 ].func_code :  33
INST_INFO[ 17 ].rs :  11
INST_INFO[ 17 ].rt :  31
INST_INFO[ 17 ].rd :  11
INST_INFO[ 17 ].shamt :  0
INST_INFO[ 18 ].value :   2328027
INST_INFO[ 18 ].opcode :  0
INST_INFO[ 18 ].func_code :  39
INST_INFO[ 18 ].rs :  17
INST_INFO[ 18 ].rt :  18
INST_INFO[ 18 ].rd :  16
INST_INFO[ 18 ].shamt :  0
INST_INFO[ 19 ].value :  1568fff4
INST_INFO[ 19 ].opcode :  5
INST_INFO[ 19 ].rs :  11
INST_INFO[ 19 ].rt :  8
INST_INFO[ 19 ].imm :  -12
INST_INFO[ 20 ].value :   8100015
INST_INFO[ 20 ].opcode :  2
INST_INFO[ 20 ].target :  1048597
INST_INFO[ 21 ].value :  31ef000f
INST_INFO[ 21 ].opcode :  12
INST_INFO[ 21 ].rs :  15
INST_INFO[ 21 ].rt :  15
INST_INFO[ 21 ].imm :  15
Memory Dump - Text Segment

text_seg[ 0 ] :  1405024
text_seg[ 4 ] :  1605824
text_seg[ 8 ] :  3c081000
text_seg[ 12 ] :  3c091000
text_seg[ 16 ] :  35290004
text_seg[ 20 ] :  254a0001
text_seg[ 24 ] :  a5040
text_seg[ 28 ] :  b5840
text_seg[ 32 ] :  254a0001
text_seg[ 36 ] :  26b5ffe8
text_seg[ 40 ] :  26a30018
text_seg[ 44 ] :  22a40018
text_seg[ 48 ] :  256b0001
text_seg[ 52 ] :  1204825
text_seg[ 56 ] :  24a9023
text_seg[ 60 ] :  119040
text_seg[ 64 ] :  128840
text_seg[ 68 ] :  17f5821
text_seg[ 72 ] :  2328027
text_seg[ 76 ] :  1568fff4
text_seg[ 80 ] :  8100015
text_seg[ 84 ] :  31ef000f
data_seg[ 0 ] :  12c
data_seg[ 4 ] :  c8
Current PC: 0
Simulating for 50 cycles...

Current register values : 
-------------------------------------
PC: 0x00400004
Register:
R0: 0x00000000
R1: 0x00000000
R2: 0x00000000
R3: 0x00000000
R4: 0x00000000
R5: 0x00000000
R6: 0x00000000
R7: 0x00000000
R8: 0x00000000
R9: 0x00000000
R10: 0x00000000
R11: 0x00000000
R12: 0x00000000
R13: 0x00000000
R14: 0x00000000
R15: 0x00000000
R16: 0x00000000
R17: 0x00000000
R18: 0x00000000
R19: 0x00000000
R20: 0x00000000
R21: 0x00000000
R22: 0x00000000
R23: 0x00000000
R24: 0x00000000
R25: 0x00000000
R26: 0x00000000
R27: 0x00000000
R28: 0x00000000
R29: 0x00000000
R30: 0x00000000
R31: 0x00000000

Memory content [0x10000000..0x10000010] :
-------------------------------------
0x10000000: 0x0000012c
0x10000004: 0x000000c8
0x10000008: 0x00000000
0x1000000c: 0x00000000
0x10000010: 0x00000000

1th cycle
Current register values : 
-------------------------------------
PC: 0x00400008
Register:
R0: 0x00000000
R1: 0x00000000
R2: 0x00000000
R3: 0x00000000
R4: 0x00000000
R5: 0x00000000
R6: 0x00000000
R7: 0x00000000
R8: 0x00000000
R9: 0x00000000
R10: 0x00000000
R11: 0x00000000
R12: 0x00000000
R13: 0x00000000
R14: 0x00000000
R15: 0x00000000
R16: 0x00000000
R17: 0x00000000
R18: 0x00000000
R19: 0x00000000
R20: 0x00000000
R21: 0x00000000
R22: 0x00000000
R23: 0x00000000
R24: 0x00000000
R25: 0x00000000
R26: 0x00000000
R27: 0x00000000
R28: 0x00000000
R29: 0x00000000
R30: 0x00000000
R31: 0x00000000

Memory content [0x10000000..0x10000010] :
-------------------------------------
0x10000000: 0x0000012c
0x10000004: 0x000000c8
0x10000008: 0x00000000
0x1000000c: 0x00000000
0x10000010: 0x00000000

2th cycle
Current register values : 
-------------------------------------
PC: 0x0040000c
Register:
R0: 0x00000000
R1: 0x00000000
R2: 0x00000000
R3: 0x00000000
R4: 0x00000000
R5: 0x00000000
R6: 0x00000000
R7: 0x00000000
R8: 0x10000000
R9: 0x00000000
R10: 0x00000000
R11: 0x00000000
R12: 0x00000000
R13: 0x00000000
R14: 0x00000000
R15: 0x00000000
R16: 0x00000000
R17: 0x00000000
R18: 0x00000000
R19: 0x00000000
R20: 0x00000000
R21: 0x00000000
R22: 0x00000000
R23: 0x00000000
R24: 0x00000000
R25: 0x00000000
R26: 0x00000000
R27: 0x00000000
R28: 0x00000000
R29: 0x00000000
R30: 0x00000000
R31: 0x00000000

Memory content [0x10000000..0x10000010] :
-------------------------------------
0x10000000: 0x0000012c
0x10000004: 0x000000c8
0x10000008: 0x00000000
0x1000000c: 0x00000000
0x10000010: 0x00000000

3th cycle
Current register values : 
-------------------------------------
PC: 0x00400010
Register:
R0: 0x00000000
R1: 0x00000000
R2: 0x00000000
R3: 0x00000000
R4: 0x00000000
R5: 0x00000000
R6: 0x00000000
R7: 0x00000000
R8: 0x10000000
R9: 0x10000000
R10: 0x00000000
R11: 0x00000000
R12: 0x00000000
R13: 0x00000000
R14: 0x00000000
R15: 0x00000000
R16: 0x00000000
R17: 0x00000000
R18: 0x00000000
R19: 0x00000000
R20: 0x00000000
R21: 0x00000000
R22: 0x00000000
R23: 0x00000000
R24: 0x00000000
R25: 0x00000000
R26: 0x00000000
R27: 0x00000000
R28: 0x00000000
R29: 0x00000000
R30: 0x00000000
R31: 0x00000000

Memory content [0x10000000..0x10000010] :
-------------------------------------
0x10000000: 0x0000012c
0x10000004: 0x000000c8
0x10000008: 0x00000000
0x1000000c: 0x00000000
0x10000010: 0x00000000

4th cycle
Current register values : 
-------------------------------------
PC: 0x00400014
Register:
R0: 0x00000000
R1: 0x00000000
R2: 0x00000000
R3: 0x00000000
R4: 0x00000000
R5: 0x00000000
R6: 0x00000000
R7: 0x00000000
R8: 0x10000000
R9: 0x10000004
R10: 0x00000000
R11: 0x00000000
R12: 0x00000000
R13: 0x00000000
R14: 0x00000000
R15: 0x00000000
R16: 0x00000000
R17: 0x00000000
R18: 0x00000000
R19: 0x00000000
R20: 0x00000000
R21: 0x00000000
R22: 0x00000000
R23: 0x00000000
R24: 0x00000000
R25: 0x00000000
R26: 0x00000000
R27: 0x00000000
R28: 0x00000000
R29: 0x00000000
R30: 0x00000000
R31: 0x00000000

Memory content [0x10000000..0x10000010] :
-------------------------------------
0x10000000: 0x0000012c
0x10000004: 0x000000c8
0x10000008: 0x00000000
0x1000000c: 0x00000000
0x10000010: 0x00000000

5th cycle
Current register values : 
-------------------------------------
PC: 0x00400018
Register:
R0: 0x00000000
R1: 0x00000000
R2: 0x00000000
R3: 0x00000000
R4: 0x00000000
R5: 0x00000000
R6: 0x00000000
R7: 0x00000000
R8: 0x10000000
R9: 0x10000004
R10: 0x00000001
R11: 0x00000000
R12: 0x00000000
R13: 0x00000000
R14: 0x00000000
R15: 0x00000000
R16: 0x00000000
R17: 0x00000000
R18: 0x00000000
R19: 0x00000000
R20: 0x00000000
R21: 0x00000000
R22: 0x00000000
R23: 0x00000000
R24: 0x00000000
R25: 0x00000000
R26: 0x00000000
R27: 0x00000000
R28: 0x00000000
R29: 0x00000000
R30: 0x00000000
R31: 0x00000000

Memory content [0x10000000..0x10000010] :
-------------------------------------
0x10000000: 0x0000012c
0x10000004: 0x000000c8
0x10000008: 0x00000000
0x1000000c: 0x00000000
0x10000010: 0x00000000

6th cycle
Current register values : 
-------------------------------------
PC: 0x0040001c
Register:
R0: 0x00000000
R1: 0x00000000
R2: 0x00000000
R3: 0x00000000
R4: 0x00000000
R5: 0x00000000
R6: 0x00000000
R7: 0x00000000
R8: 0x10000000
R9: 0x10000004
R10: 0x00000002
R11: 0x00000000
R12: 0x00000000
R13: 0x00000000
R14: 0x00000000
R15: 0x00000000
R16: 0x00000000
R17: 0x00000000
R18: 0x00000000
R19: 0x00000000
R20: 0x00000000
R21: 0x00000000
R22: 0x00000000
R23: 0x00000000
R24: 0x00000000
R25: 0x00000000
R26: 0x00000000
R27: 0x00000000
R28: 0x00000000
R29: 0x00000000
R30: 0x00000000
R31: 0x00000000

Memory content [0x10000000..0x10000010] :
-------------------------------------
0x10000000: 0x0000012c
0x10000004: 0x000000c8
0x10000008: 0x00000000
0x1000000c: 0x00000000
0x10000010: 0x00000000

7th cycle
Current register values : 
-------------------------------------
PC: 0x00400020
Register:
R0: 0x00000000
R1: 0x00000000
R2: 0x00000000
R3: 0x00000000
R4: 0x00000000
R5: 0x00000000
R6: 0x00000000
R7: 0x00000000
R8: 0x10000000
R9: 0x10000004
R10: 0x00000002
R11: 0x00000000
R12: 0x00000000
R13: 0x00000000
R14: 0x00000000
R15: 0x00000000
R16: 0x00000000
R17: 0x00000000
R18: 0x00000000
R19: 0x00000000
R20: 0x00000000
R21: 0x00000000
R22: 0x00000000
R23: 0x00000000
R24: 0x00000000
R25: 0x00000000
R26: 0x00000000
R27: 0x00000000
R28: 0x00000000
R29: 0x00000000
R30: 0x00000000
R31: 0x00000000

Memory content [0x10000000..0x10000010] :
-------------------------------------
0x10000000: 0x0000012c
0x10000004: 0x000000c8
0x10000008: 0x00000000
0x1000000c: 0x00000000
0x10000010: 0x00000000

8th cycle
Current register values : 
-------------------------------------
PC: 0x00400024
Register:
R0: 0x00000000
R1: 0x00000000
R2: 0x00000000
R3: 0x00000000
R4: 0x00000000
R5: 0x00000000
R6: 0x00000000
R7: 0x00000000
R8: 0x10000000
R9: 0x10000004
R10: 0x00000003
R11: 0x00000000
R12: 0x00000000
R13: 0x00000000
R14: 0x00000000
R15: 0x00000000
R16: 0x00000000
R17: 0x00000000
R18: 0x00000000
R19: 0x00000000
R20: 0x00000000
R21: 0x00000000
R22: 0x00000000
R23: 0x00000000
R24: 0x00000000
R25: 0x00000000
R26: 0x00000000
R27: 0x00000000
R28: 0x00000000
R29: 0x00000000
R30: 0x00000000
R31: 0x00000000

Memory content [0x10000000..0x10000010] :
-------------------------------------
0x10000000: 0x0000012c
0x10000004: 0x000000c8
0x10000008: 0x00000000
0x1000000c: 0x00000000
0x10000010: 0x00000000

9th cycle
Current register values : 
-------------------------------------
PC: 0x00400028
Register:
R0: 0x00000000
R1: 0x00000000
R2: 0x00000000
R3: 0x00000000
R4: 0x00000000
R5: 0x00000000
R6: 0x00000000
R7: 0x00000000
R8: 0x10000000
R9: 0x10000004
R10: 0x00000003
R11: 0x00000000
R12: 0x00000000
R13: 0x00000000
R14: 0x00000000
R15: 0x00000000
R16: 0x00000000
R17: 0x00000000
R18: 0x00000000
R19: 0x00000000
R20: 0x00000000
R21: 0xffffffe8
R22: 0x00000000
R23: 0x00000000
R24: 0x00000000
R25: 0x00000000
R26: 0x00000000
R27: 0x00000000
R28: 0x00000000
R29: 0x00000000
R30: 0x00000000
R31: 0x00000000

Memory content [0x10000000..0x10000010] :
-------------------------------------
0x10000000: 0x0000012c
0x10000004: 0x000000c8
0x10000008: 0x00000000
0x1000000c: 0x00000000
0x10000010: 0x00000000

10th cycle
Current register values : 
-------------------------------------
PC: 0x0040002c
Register:
R0: 0x00000000
R1: 0x00000000
R2: 0x00000000
R3: 0x00000000
R4: 0x00000000
R5: 0x00000000
R6: 0x00000000
R7: 0x00000000
R8: 0x10000000
R9: 0x10000004
R10: 0x00000003
R11: 0x00000000
R12: 0x00000000
R13: 0x00000000
R14: 0x00000000
R15: 0x00000000
R16: 0x00000000
R17: 0x00000000
R18: 0x00000000
R19: 0x00000000
R20: 0x00000000
R21: 0xffffffe8
R22: 0x00000000
R23: 0x00000000
R24: 0x00000000
R25: 0x00000000
R26: 0x00000000
R27: 0x00000000
R28: 0x00000000
R29: 0x00000000
R30: 0x00000000
R31: 0x00000000

Memory content [0x10000000..0x10000010] :
-------------------------------------
0x10000000: 0x0000012c
0x10000004: 0x000000c8
0x10000008: 0x00000000
0x1000000c: 0x00000000
0x10000010: 0x00000000

11th cycle
Current register values : 
-------------------------------------
PC: 0x00400030
Register:
R0: 0x00000000
R1: 0x00000000
R2: 0x00000000
R3: 0x00000000
R4: 0x00000000
R5: 0x00000000
R6: 0x00000000
R7: 0x00000000
R8: 0x10000000
R9: 0x10000004
R10: 0x00000003
R11: 0x00000000
R12: 0x00000000
R13: 0x00000000
R14: 0x00000000
R15: 0x00000000
R16: 0x00000000
R17: 0x00000000
R18: 0x00000000
R19: 0x00000000
R20: 0x00000000
R21: 0xffffffe8
R22: 0x00000000
R23: 0x00000000
R24: 0x00000000
R25: 0x00000000
R26: 0x00000000
R27: 0x00000000
R28: 0x00000000
R29: 0x00000000
R30: 0x00000000
R31: 0x00000000

Memory content [0x10000000..0x10000010] :
-------------------------------------
0x10000000: 0x0000012c
0x10000004: 0x000000c8
0x10000008: 0x00000000
0x1000000c: 0x00000000
0x10000010: 0x00000000

12th cycle
Current register values : 
-------------------------------------
PC: 0x00400034
Register:
R0: 0x00000000
R1: 0x00000000
R2: 0x00000000
R3: 0x00000000
R4: 0x00000000
R5: 0x00000000
R6: 0x00000000
R7: 0x00000000
R8: 0x10000000
R9: 0x10000004
R10: 0x00000003
R11: 0x00000001
R12: 0x00000000
R13: 0x00000000
R14: 0x00000000
R15: 0x00000000
R16: 0x00000000
R17: 0x00000000
R18: 0x00000000
R19: 0x00000000
R20: 0x00000000
R21: 0xffffffe8
R22: 0x00000000
R23: 0x00000000
R24: 0x00000000
R25: 0x00000000
R26: 0x00000000
R27: 0x00000000
R28: 0x00000000
R29: 0x00000000
R30: 0x00000000
R31: 0x00000000

Memory content [0x10000000..0x10000010] :
-------------------------------------
0x10000000: 0x0000012c
0x10000004: 0x000000c8
0x10000008: 0x00000000
0x1000000c: 0x00000000
0x10000010: 0x00000000

13th cycle
Current register values : 
-------------------------------------
PC: 0x00400038
Register:
R0: 0x00000000
R1: 0x00000000
R2: 0x00000000
R3: 0x00000000
R4: 0x00000000
R5: 0x00000000
R6: 0x00000000
R7: 0x00000000
R8: 0x10000000
R9: 0x10000004
R10: 0x00000003
R11: 0x00000001
R12: 0x00000000
R13: 0x00000000
R14: 0x00000000
R15: 0x00000000
R16: 0x00000000
R17: 0x00000000
R18: 0x00000000
R19: 0x00000000
R20: 0x00000000
R21: 0xffffffe8
R22: 0x00000000
R23: 0x00000000
R24: 0x00000000
R25: 0x00000000
R26: 0x00000000
R27: 0x00000000
R28: 0x00000000
R29: 0x00000000
R30: 0x00000000
R31: 0x00000000

Memory content [0x10000000..0x10000010] :
-------------------------------------
0x10000000: 0x0000012c
0x10000004: 0x000000c8
0x10000008: 0x00000000
0x1000000c: 0x00000000
0x10000010: 0x00000000

14th cycle
Current register values : 
-------------------------------------
PC: 0x0040003c
Register:
R0: 0x00000000
R1: 0x00000000
R2: 0x00000000
R3: 0x00000000
R4: 0x00000000
R5: 0x00000000
R6: 0x00000000
R7: 0x00000000
R8: 0x10000000
R9: 0x10000004
R10: 0x00000003
R11: 0x00000001
R12: 0x00000000
R13: 0x00000000
R14: 0x00000000
R15: 0x00000000
R16: 0x00000000
R17: 0x00000000
R18: 0xfffffffd
R19: 0x00000000
R20: 0x00000000
R21: 0xffffffe8
R22: 0x00000000
R23: 0x00000000
R24: 0x00000000
R25: 0x00000000
R26: 0x00000000
R27: 0x00000000
R28: 0x00000000
R29: 0x00000000
R30: 0x00000000
R31: 0x00000000

Memory content [0x10000000..0x10000010] :
-------------------------------------
0x10000000: 0x0000012c
0x10000004: 0x000000c8
0x10000008: 0x00000000
0x1000000c: 0x00000000
0x10000010: 0x00000000

15th cycle
Current register values : 
-------------------------------------
PC: 0x00400040
Register:
R0: 0x00000000
R1: 0x00000000
R2: 0x00000000
R3: 0x00000000
R4: 0x00000000
R5: 0x00000000
R6: 0x00000000
R7: 0x00000000
R8: 0x10000000
R9: 0x10000004
R10: 0x00000003
R11: 0x00000001
R12: 0x00000000
R13: 0x00000000
R14: 0x00000000
R15: 0x00000000
R16: 0x00000000
R17: 0x00000000
R18: 0x00000000
R19: 0x00000000
R20: 0x00000000
R21: 0xffffffe8
R22: 0x00000000
R23: 0x00000000
R24: 0x00000000
R25: 0x00000000
R26: 0x00000000
R27: 0x00000000
R28: 0x00000000
R29: 0x00000000
R30: 0x00000000
R31: 0x00000000

Memory content [0x10000000..0x10000010] :
-------------------------------------
0x10000000: 0x0000012c
0x10000004: 0x000000c8
0x10000008: 0x00000000
0x1000000c: 0x00000000
0x10000010: 0x00000000

16th cycle
Current register values : 
-------------------------------------
PC: 0x00400044
Register:
R0: 0x00000000
R1: 0x00000000
R2: 0x00000000
R3: 0x00000000
R4: 0x00000000
R5: 0x00000000
R6: 0x00000000
R7: 0x00000000
R8: 0x10000000
R9: 0x10000004
R10: 0x00000003
R11: 0x00000001
R12: 0x00000000
R13: 0x00000000
R14: 0x00000000
R15: 0x00000000
R16: 0x00000000
R17: 0x00000000
R18: 0x00000000
R19: 0x00000000
R20: 0x00000000
R21: 0xffffffe8
R22: 0x00000000
R23: 0x00000000
R24: 0x00000000
R25: 0x00000000
R26: 0x00000000
R27: 0x00000000
R28: 0x00000000
R29: 0x00000000
R30: 0x00000000
R31: 0x00000000

Memory content [0x10000000..0x10000010] :
-------------------------------------
0x10000000: 0x0000012c
0x10000004: 0x000000c8
0x10000008: 0x00000000
0x1000000c: 0x00000000
0x10000010: 0x00000000

17th cycle
Current register values : 
-------------------------------------
PC: 0x00400048
Register:
R0: 0x00000000
R1: 0x00000000
R2: 0x00000000
R3: 0x00000000
R4: 0x00000000
R5: 0x00000000
R6: 0x00000000
R7: 0x00000000
R8: 0x10000000
R9: 0x10000004
R10: 0x00000003
R11: 0x00000001
R12: 0x00000000
R13: 0x00000000
R14: 0x00000000
R15: 0x00000000
R16: 0x00000000
R17: 0x00000000
R18: 0x00000000
R19: 0x00000000
R20: 0x00000000
R21: 0xffffffe8
R22: 0x00000000
R23: 0x00000000
R24: 0x00000000
R25: 0x00000000
R26: 0x00000000
R27: 0x00000000
R28: 0x00000000
R29: 0x00000000
R30: 0x00000000
R31: 0x00000000

Memory content [0x10000000..0x10000010] :
-------------------------------------
0x10000000: 0x0000012c
0x10000004: 0x000000c8
0x10000008: 0x00000000
0x1000000c: 0x00000000
0x10000010: 0x00000000

18th cycle
Current register values : 
-------------------------------------
PC: 0x0040004c
Register:
R0: 0x00000000
R1: 0x00000000
R2: 0x00000000
R3: 0x00000000
R4: 0x00000000
R5: 0x00000000
R6: 0x00000000
R7: 0x00000000
R8: 0x10000000
R9: 0x10000004
R10: 0x00000003
R11: 0x00000001
R12: 0x00000000
R13: 0x00000000
R14: 0x00000000
R15: 0x00000000
R16: 0xffffffff
R17: 0x00000000
R18: 0x00000000
R19: 0x00000000
R20: 0x00000000
R21: 0xffffffe8
R22: 0x00000000
R23: 0x00000000
R24: 0x00000000
R25: 0x00000000
R26: 0x00000000
R27: 0x00000000
R28: 0x00000000
R29: 0x00000000
R30: 0x00000000
R31: 0x00000000

Memory content [0x10000000..0x10000010] :
-------------------------------------
0x10000000: 0x0000012c
0x10000004: 0x000000c8
0x10000008: 0x00000000
0x1000000c: 0x00000000
0x10000010: 0x00000000

19th cycle
Current register values : 
-------------------------------------
PC: 0x00400020
Register:
R0: 0x00000000
R1: 0x00000000
R2: 0x00000000
R3: 0x00000000
R4: 0x00000000
R5: 0x00000000
R6: 0x00000000
R7: 0x00000000
R8: 0x10000000
R9: 0x10000004
R10: 0x00000003
R11: 0x00000001
R12: 0x00000000
R13: 0x00000000
R14: 0x00000000
R15: 0x00000000
R16: 0xffffffff
R17: 0x00000000
R18: 0x00000000
R19: 0x00000000
R20: 0x00000000
R21: 0xffffffe8
R22: 0x00000000
R23: 0x00000000
R24: 0x00000000
R25: 0x00000000
R26: 0x00000000
R27: 0x00000000
R28: 0x00000000
R29: 0x00000000
R30: 0x00000000
R31: 0x00000000

Memory content [0x10000000..0x10000010] :
-------------------------------------
0x10000000: 0x0000012c
0x10000004: 0x000000c8
0x10000008: 0x00000000
0x1000000c: 0x00000000
0x10000010: 0x00000000

20th cycle
Current register values : 
-------------------------------------
PC: 0x00400024
Register:
R0: 0x00000000
R1: 0x00000000
R2: 0x00000000
R3: 0x00000000
R4: 0x00000000
R5: 0x00000000
R6: 0x00000000
R7: 0x00000000
R8: 0x10000000
R9: 0x10000004
R10: 0x00000004
R11: 0x00000001
R12: 0x00000000
R13: 0x00000000
R14: 0x00000000
R15: 0x00000000
R16: 0xffffffff
R17: 0x00000000
R18: 0x00000000
R19: 0x00000000
R20: 0x00000000
R21: 0xffffffe8
R22: 0x00000000
R23: 0x00000000
R24: 0x00000000
R25: 0x00000000
R26: 0x00000000
R27: 0x00000000
R28: 0x00000000
R29: 0x00000000
R30: 0x00000000
R31: 0x00000000

Memory content [0x10000000..0x10000010] :
-------------------------------------
0x10000000: 0x0000012c
0x10000004: 0x000000c8
0x10000008: 0x00000000
0x1000000c: 0x00000000
0x10000010: 0x00000000

21th cycle
Current register values : 
-------------------------------------
PC: 0x00400028
Register:
R0: 0x00000000
R1: 0x00000000
R2: 0x00000000
R3: 0x00000000
R4: 0x00000000
R5: 0x00000000
R6: 0x00000000
R7: 0x00000000
R8: 0x10000000
R9: 0x10000004
R10: 0x00000004
R11: 0x00000001
R12: 0x00000000
R13: 0x00000000
R14: 0x00000000
R15: 0x00000000
R16: 0xffffffff
R17: 0x00000000
R18: 0x00000000
R19: 0x00000000
R20: 0x00000000
R21: 0xffffffd0
R22: 0x00000000
R23: 0x00000000
R24: 0x00000000
R25: 0x00000000
R26: 0x00000000
R27: 0x00000000
R28: 0x00000000
R29: 0x00000000
R30: 0x00000000
R31: 0x00000000

Memory content [0x10000000..0x10000010] :
-------------------------------------
0x10000000: 0x0000012c
0x10000004: 0x000000c8
0x10000008: 0x00000000
0x1000000c: 0x00000000
0x10000010: 0x00000000

22th cycle
Current register values : 
-------------------------------------
PC: 0x0040002c
Register:
R0: 0x00000000
R1: 0x00000000
R2: 0x00000000
R3: 0xffffffe8
R4: 0x00000000
R5: 0x00000000
R6: 0x00000000
R7: 0x00000000
R8: 0x10000000
R9: 0x10000004
R10: 0x00000004
R11: 0x00000001
R12: 0x00000000
R13: 0x00000000
R14: 0x00000000
R15: 0x00000000
R16: 0xffffffff
R17: 0x00000000
R18: 0x00000000
R19: 0x00000000
R20: 0x00000000
R21: 0xffffffd0
R22: 0x00000000
R23: 0x00000000
R24: 0x00000000
R25: 0x00000000
R26: 0x00000000
R27: 0x00000000
R28: 0x00000000
R29: 0x00000000
R30: 0x00000000
R31: 0x00000000

Memory content [0x10000000..0x10000010] :
-------------------------------------
0x10000000: 0x0000012c
0x10000004: 0x000000c8
0x10000008: 0x00000000
0x1000000c: 0x00000000
0x10000010: 0x00000000

23th cycle
Current register values : 
-------------------------------------
PC: 0x00400030
Register:
R0: 0x00000000
R1: 0x00000000
R2: 0x00000000
R3: 0xffffffe8
R4: 0xffffffe8
R5: 0x00000000
R6: 0x00000000
R7: 0x00000000
R8: 0x10000000
R9: 0x10000004
R10: 0x00000004
R11: 0x00000001
R12: 0x00000000
R13: 0x00000000
R14: 0x00000000
R15: 0x00000000
R16: 0xffffffff
R17: 0x00000000
R18: 0x00000000
R19: 0x00000000
R20: 0x00000000
R21: 0xffffffd0
R22: 0x00000000
R23: 0x00000000
R24: 0x00000000
R25: 0x00000000
R26: 0x00000000
R27: 0x00000000
R28: 0x00000000
R29: 0x00000000
R30: 0x00000000
R31: 0x00000000

Memory content [0x10000000..0x10000010] :
-------------------------------------
0x10000000: 0x0000012c
0x10000004: 0x000000c8
0x10000008: 0x00000000
0x1000000c: 0x00000000
0x10000010: 0x00000000

24th cycle
Current register values : 
-------------------------------------
PC: 0x00400034
Register:
R0: 0x00000000
R1: 0x00000000
R2: 0x00000000
R3: 0xffffffe8
R4: 0xffffffe8
R5: 0x00000000
R6: 0x00000000
R7: 0x00000000
R8: 0x10000000
R9: 0x10000004
R10: 0x00000004
R11: 0x00000002
R12: 0x00000000
R13: 0x00000000
R14: 0x00000000
R15: 0x00000000
R16: 0xffffffff
R17: 0x00000000
R18: 0x00000000
R19: 0x00000000
R20: 0x00000000
R21: 0xffffffd0
R22: 0x00000000
R23: 0x00000000
R24: 0x00000000
R25: 0x00000000
R26: 0x00000000
R27: 0x00000000
R28: 0x00000000
R29: 0x00000000
R30: 0x00000000
R31: 0x00000000

Memory content [0x10000000..0x10000010] :
-------------------------------------
0x10000000: 0x0000012c
0x10000004: 0x000000c8
0x10000008: 0x00000000
0x1000000c: 0x00000000
0x10000010: 0x00000000

25th cycle
Current register values : 
-------------------------------------
PC: 0x00400038
Register:
R0: 0x00000000
R1: 0x00000000
R2: 0x00000000
R3: 0xffffffe8
R4: 0xffffffe8
R5: 0x00000000
R6: 0x00000000
R7: 0x00000000
R8: 0x10000000
R9: 0x10000004
R10: 0x00000004
R11: 0x00000002
R12: 0x00000000
R13: 0x00000000
R14: 0x00000000
R15: 0x00000000
R16: 0xffffffff
R17: 0x00000000
R18: 0x00000000
R19: 0x00000000
R20: 0x00000000
R21: 0xffffffd0
R22: 0x00000000
R23: 0x00000000
R24: 0x00000000
R25: 0x00000000
R26: 0x00000000
R27: 0x00000000
R28: 0x00000000
R29: 0x00000000
R30: 0x00000000
R31: 0x00000000

Memory content [0x10000000..0x10000010] :
-------------------------------------
0x10000000: 0x0000012c
0x10000004: 0x000000c8
0x10000008: 0x00000000
0x1000000c: 0x00000000
0x10000010: 0x00000000

26th cycle
Current register values : 
-------------------------------------
PC: 0x0040003c
Register:
R0: 0x00000000
R1: 0x00000000
R2: 0x00000000
R3: 0xffffffe8
R4: 0xffffffe8
R5: 0x00000000
R6: 0x00000000
R7: 0x00000000
R8: 0x10000000
R9: 0x10000004
R10: 0x00000004
R11: 0x00000002
R12: 0x00000000
R13: 0x00000000
R14: 0x00000000
R15: 0x00000000
R16: 0xffffffff
R17: 0x00000000
R18: 0xfffffffc
R19: 0x00000000
R20: 0x00000000
R21: 0xffffffd0
R22: 0x00000000
R23: 0x00000000
R24: 0x00000000
R25: 0x00000000
R26: 0x00000000
R27: 0x00000000
R28: 0x00000000
R29: 0x00000000
R30: 0x00000000
R31: 0x00000000

Memory content [0x10000000..0x10000010] :
-------------------------------------
0x10000000: 0x0000012c
0x10000004: 0x000000c8
0x10000008: 0x00000000
0x1000000c: 0x00000000
0x10000010: 0x00000000

27th cycle
Current register values : 
-------------------------------------
PC: 0x00400040
Register:
R0: 0x00000000
R1: 0x00000000
R2: 0x00000000
R3: 0xffffffe8
R4: 0xffffffe8
R5: 0x00000000
R6: 0x00000000
R7: 0x00000000
R8: 0x10000000
R9: 0x10000004
R10: 0x00000004
R11: 0x00000002
R12: 0x00000000
R13: 0x00000000
R14: 0x00000000
R15: 0x00000000
R16: 0xffffffff
R17: 0x00000000
R18: 0x00000000
R19: 0x00000000
R20: 0x00000000
R21: 0xffffffd0
R22: 0x00000000
R23: 0x00000000
R24: 0x00000000
R25: 0x00000000
R26: 0x00000000
R27: 0x00000000
R28: 0x00000000
R29: 0x00000000
R30: 0x00000000
R31: 0x00000000

Memory content [0x10000000..0x10000010] :
-------------------------------------
0x10000000: 0x0000012c
0x10000004: 0x000000c8
0x10000008: 0x00000000
0x1000000c: 0x00000000
0x10000010: 0x00000000

28th cycle
Current register values : 
-------------------------------------
PC: 0x00400044
Register:
R0: 0x00000000
R1: 0x00000000
R2: 0x00000000
R3: 0xffffffe8
R4: 0xffffffe8
R5: 0x00000000
R6: 0x00000000
R7: 0x00000000
R8: 0x10000000
R9: 0x10000004
R10: 0x00000004
R11: 0x00000002
R12: 0x00000000
R13: 0x00000000
R14: 0x00000000
R15: 0x00000000
R16: 0xffffffff
R17: 0x00000000
R18: 0x00000000
R19: 0x00000000
R20: 0x00000000
R21: 0xffffffd0
R22: 0x00000000
R23: 0x00000000
R24: 0x00000000
R25: 0x00000000
R26: 0x00000000
R27: 0x00000000
R28: 0x00000000
R29: 0x00000000
R30: 0x00000000
R31: 0x00000000

Memory content [0x10000000..0x10000010] :
-------------------------------------
0x10000000: 0x0000012c
0x10000004: 0x000000c8
0x10000008: 0x00000000
0x1000000c: 0x00000000
0x10000010: 0x00000000

29th cycle
Current register values : 
-------------------------------------
PC: 0x00400048
Register:
R0: 0x00000000
R1: 0x00000000
R2: 0x00000000
R3: 0xffffffe8
R4: 0xffffffe8
R5: 0x00000000
R6: 0x00000000
R7: 0x00000000
R8: 0x10000000
R9: 0x10000004
R10: 0x00000004
R11: 0x00000002
R12: 0x00000000
R13: 0x00000000
R14: 0x00000000
R15: 0x00000000
R16: 0xffffffff
R17: 0x00000000
R18: 0x00000000
R19: 0x00000000
R20: 0x00000000
R21: 0xffffffd0
R22: 0x00000000
R23: 0x00000000
R24: 0x00000000
R25: 0x00000000
R26: 0x00000000
R27: 0x00000000
R28: 0x00000000
R29: 0x00000000
R30: 0x00000000
R31: 0x00000000

Memory content [0x10000000..0x10000010] :
-------------------------------------
0x10000000: 0x0000012c
0x10000004: 0x000000c8
0x10000008: 0x00000000
0x1000000c: 0x00000000
0x10000010: 0x00000000

30th cycle
Current register values : 
-------------------------------------
PC: 0x0040004c
Register:
R0: 0x00000000
R1: 0x00000000
R2: 0x00000000
R3: 0xffffffe8
R4: 0xffffffe8
R5: 0x00000000
R6: 0x00000000
R7: 0x00000000
R8: 0x10000000
R9: 0x10000004
R10: 0x00000004
R11: 0x00000002
R12: 0x00000000
R13: 0x00000000
R14: 0x00000000
R15: 0x00000000
R16: 0xffffffff
R17: 0x00000000
R18: 0x00000000
R19: 0x00000000
R20: 0x00000000
R21: 0xffffffd0
R22: 0x00000000
R23: 0x00000000
R24: 0x00000000
R25: 0x00000000
R26: 0x00000000
R27: 0x00000000
R28: 0x00000000
R29: 0x00000000
R30: 0x00000000
R31: 0x00000000

Memory content [0x10000000..0x10000010] :
-------------------------------------
0x10000000: 0x0000012c
0x10000004: 0x000000c8
0x10000008: 0x00000000
0x1000000c: 0x00000000
0x10000010: 0x00000000

31th cycle
Current register values : 
-------------------------------------
PC: 0x00400020
Register:
R0: 0x00000000
R1: 0x00000000
R2: 0x00000000
R3: 0xffffffe8
R4: 0xffffffe8
R5: 0x00000000
R6: 0x00000000
R7: 0x00000000
R8: 0x10000000
R9: 0x10000004
R10: 0x00000004
R11: 0x00000002
R12: 0x00000000
R13: 0x00000000
R14: 0x00000000
R15: 0x00000000
R16: 0xffffffff
R17: 0x00000000
R18: 0x00000000
R19: 0x00000000
R20: 0x00000000
R21: 0xffffffd0
R22: 0x00000000
R23: 0x00000000
R24: 0x00000000
R25: 0x00000000
R26: 0x00000000
R27: 0x00000000
R28: 0x00000000
R29: 0x00000000
R30: 0x00000000
R31: 0x00000000

Memory content [0x10000000..0x10000010] :
-------------------------------------
0x10000000: 0x0000012c
0x10000004: 0x000000c8
0x10000008: 0x00000000
0x1000000c: 0x00000000
0x10000010: 0x00000000

32th cycle
Current register values : 
-------------------------------------
PC: 0x00400024
Register:
R0: 0x00000000
R1: 0x00000000
R2: 0x00000000
R3: 0xffffffe8
R4: 0xffffffe8
R5: 0x00000000
R6: 0x00000000
R7: 0x00000000
R8: 0x10000000
R9: 0x10000004
R10: 0x00000005
R11: 0x00000002
R12: 0x00000000
R13: 0x00000000
R14: 0x00000000
R15: 0x00000000
R16: 0xffffffff
R17: 0x00000000
R18: 0x00000000
R19: 0x00000000
R20: 0x00000000
R21: 0xffffffd0
R22: 0x00000000
R23: 0x00000000
R24: 0x00000000
R25: 0x00000000
R26: 0x00000000
R27: 0x00000000
R28: 0x00000000
R29: 0x00000000
R30: 0x00000000
R31: 0x00000000

Memory content [0x10000000..0x10000010] :
-------------------------------------
0x10000000: 0x0000012c
0x10000004: 0x000000c8
0x10000008: 0x00000000
0x1000000c: 0x00000000
0x10000010: 0x00000000

33th cycle
Current register values : 
-------------------------------------
PC: 0x00400028
Register:
R0: 0x00000000
R1: 0x00000000
R2: 0x00000000
R3: 0xffffffe8
R4: 0xffffffe8
R5: 0x00000000
R6: 0x00000000
R7: 0x00000000
R8: 0x10000000
R9: 0x10000004
R10: 0x00000005
R11: 0x00000002
R12: 0x00000000
R13: 0x00000000
R14: 0x00000000
R15: 0x00000000
R16: 0xffffffff
R17: 0x00000000
R18: 0x00000000
R19: 0x00000000
R20: 0x00000000
R21: 0xffffffb8
R22: 0x00000000
R23: 0x00000000
R24: 0x00000000
R25: 0x00000000
R26: 0x00000000
R27: 0x00000000
R28: 0x00000000
R29: 0x00000000
R30: 0x00000000
R31: 0x00000000

Memory content [0x10000000..0x10000010] :
-------------------------------------
0x10000000: 0x0000012c
0x10000004: 0x000000c8
0x10000008: 0x00000000
0x1000000c: 0x00000000
0x10000010: 0x00000000

34th cycle
Current register values : 
-------------------------------------
PC: 0x0040002c
Register:
R0: 0x00000000
R1: 0x00000000
R2: 0x00000000
R3: 0xffffffd0
R4: 0xffffffe8
R5: 0x00000000
R6: 0x00000000
R7: 0x00000000
R8: 0x10000000
R9: 0x10000004
R10: 0x00000005
R11: 0x00000002
R12: 0x00000000
R13: 0x00000000
R14: 0x00000000
R15: 0x00000000
R16: 0xffffffff
R17: 0x00000000
R18: 0x00000000
R19: 0x00000000
R20: 0x00000000
R21: 0xffffffb8
R22: 0x00000000
R23: 0x00000000
R24: 0x00000000
R25: 0x00000000
R26: 0x00000000
R27: 0x00000000
R28: 0x00000000
R29: 0x00000000
R30: 0x00000000
R31: 0x00000000

Memory content [0x10000000..0x10000010] :
-------------------------------------
0x10000000: 0x0000012c
0x10000004: 0x000000c8
0x10000008: 0x00000000
0x1000000c: 0x00000000
0x10000010: 0x00000000

35th cycle
Current register values : 
-------------------------------------
PC: 0x00400030
Register:
R0: 0x00000000
R1: 0x00000000
R2: 0x00000000
R3: 0xffffffd0
R4: 0xffffffd0
R5: 0x00000000
R6: 0x00000000
R7: 0x00000000
R8: 0x10000000
R9: 0x10000004
R10: 0x00000005
R11: 0x00000002
R12: 0x00000000
R13: 0x00000000
R14: 0x00000000
R15: 0x00000000
R16: 0xffffffff
R17: 0x00000000
R18: 0x00000000
R19: 0x00000000
R20: 0x00000000
R21: 0xffffffb8
R22: 0x00000000
R23: 0x00000000
R24: 0x00000000
R25: 0x00000000
R26: 0x00000000
R27: 0x00000000
R28: 0x00000000
R29: 0x00000000
R30: 0x00000000
R31: 0x00000000

Memory content [0x10000000..0x10000010] :
-------------------------------------
0x10000000: 0x0000012c
0x10000004: 0x000000c8
0x10000008: 0x00000000
0x1000000c: 0x00000000
0x10000010: 0x00000000

36th cycle
Current register values : 
-------------------------------------
PC: 0x00400034
Register:
R0: 0x00000000
R1: 0x00000000
R2: 0x00000000
R3: 0xffffffd0
R4: 0xffffffd0
R5: 0x00000000
R6: 0x00000000
R7: 0x00000000
R8: 0x10000000
R9: 0x10000004
R10: 0x00000005
R11: 0x00000003
R12: 0x00000000
R13: 0x00000000
R14: 0x00000000
R15: 0x00000000
R16: 0xffffffff
R17: 0x00000000
R18: 0x00000000
R19: 0x00000000
R20: 0x00000000
R21: 0xffffffb8
R22: 0x00000000
R23: 0x00000000
R24: 0x00000000
R25: 0x00000000
R26: 0x00000000
R27: 0x00000000
R28: 0x00000000
R29: 0x00000000
R30: 0x00000000
R31: 0x00000000

Memory content [0x10000000..0x10000010] :
-------------------------------------
0x10000000: 0x0000012c
0x10000004: 0x000000c8
0x10000008: 0x00000000
0x1000000c: 0x00000000
0x10000010: 0x00000000

37th cycle
Current register values : 
-------------------------------------
PC: 0x00400038
Register:
R0: 0x00000000
R1: 0x00000000
R2: 0x00000000
R3: 0xffffffd0
R4: 0xffffffd0
R5: 0x00000000
R6: 0x00000000
R7: 0x00000000
R8: 0x10000000
R9: 0x10000004
R10: 0x00000005
R11: 0x00000003
R12: 0x00000000
R13: 0x00000000
R14: 0x00000000
R15: 0x00000000
R16: 0xffffffff
R17: 0x00000000
R18: 0x00000000
R19: 0x00000000
R20: 0x00000000
R21: 0xffffffb8
R22: 0x00000000
R23: 0x00000000
R24: 0x00000000
R25: 0x00000000
R26: 0x00000000
R27: 0x00000000
R28: 0x00000000
R29: 0x00000000
R30: 0x00000000
R31: 0x00000000

Memory content [0x10000000..0x10000010] :
-------------------------------------
0x10000000: 0x0000012c
0x10000004: 0x000000c8
0x10000008: 0x00000000
0x1000000c: 0x00000000
0x10000010: 0x00000000

38th cycle
Current register values : 
-------------------------------------
PC: 0x0040003c
Register:
R0: 0x00000000
R1: 0x00000000
R2: 0x00000000
R3: 0xffffffd0
R4: 0xffffffd0
R5: 0x00000000
R6: 0x00000000
R7: 0x00000000
R8: 0x10000000
R9: 0x10000004
R10: 0x00000005
R11: 0x00000003
R12: 0x00000000
R13: 0x00000000
R14: 0x00000000
R15: 0x00000000
R16: 0xffffffff
R17: 0x00000000
R18: 0xfffffffb
R19: 0x00000000
R20: 0x00000000
R21: 0xffffffb8
R22: 0x00000000
R23: 0x00000000
R24: 0x00000000
R25: 0x00000000
R26: 0x00000000
R27: 0x00000000
R28: 0x00000000
R29: 0x00000000
R30: 0x00000000
R31: 0x00000000

Memory content [0x10000000..0x10000010] :
-------------------------------------
0x10000000: 0x0000012c
0x10000004: 0x000000c8
0x10000008: 0x00000000
0x1000000c: 0x00000000
0x10000010: 0x00000000

39th cycle
Current register values : 
-------------------------------------
PC: 0x00400040
Register:
R0: 0x00000000
R1: 0x00000000
R2: 0x00000000
R3: 0xffffffd0
R4: 0xffffffd0
R5: 0x00000000
R6: 0x00000000
R7: 0x00000000
R8: 0x10000000
R9: 0x10000004
R10: 0x00000005
R11: 0x00000003
R12: 0x00000000
R13: 0x00000000
R14: 0x00000000
R15: 0x00000000
R16: 0xffffffff
R17: 0x00000000
R18: 0x00000000
R19: 0x00000000
R20: 0x00000000
R21: 0xffffffb8
R22: 0x00000000
R23: 0x00000000
R24: 0x00000000
R25: 0x00000000
R26: 0x00000000
R27: 0x00000000
R28: 0x00000000
R29: 0x00000000
R30: 0x00000000
R31: 0x00000000

Memory content [0x10000000..0x10000010] :
-------------------------------------
0x10000000: 0x0000012c
0x10000004: 0x000000c8
0x10000008: 0x00000000
0x1000000c: 0x00000000
0x10000010: 0x00000000

40th cycle
Current register values : 
-------------------------------------
PC: 0x00400044
Register:
R0: 0x00000000
R1: 0x00000000
R2: 0x00000000
R3: 0xffffffd0
R4: 0xffffffd0
R5: 0x00000000
R6: 0x00000000
R7: 0x00000000
R8: 0x10000000
R9: 0x10000004
R10: 0x00000005
R11: 0x00000003
R12: 0x00000000
R13: 0x00000000
R14: 0x00000000
R15: 0x00000000
R16: 0xffffffff
R17: 0x00000000
R18: 0x00000000
R19: 0x00000000
R20: 0x00000000
R21: 0xffffffb8
R22: 0x00000000
R23: 0x00000000
R24: 0x00000000
R25: 0x00000000
R26: 0x00000000
R27: 0x00000000
R28: 0x00000000
R29: 0x00000000
R30: 0x00000000
R31: 0x00000000

Memory content [0x10000000..0x10000010] :
-------------------------------------
0x10000000: 0x0000012c
0x10000004: 0x000000c8
0x10000008: 0x00000000
0x1000000c: 0x00000000
0x10000010: 0x00000000

41th cycle
Current register values : 
-------------------------------------
PC: 0x00400048
Register:
R0: 0x00000000
R1: 0x00000000
R2: 0x00000000
R3: 0xffffffd0
R4: 0xffffffd0
R5: 0x00000000
R6: 0x00000000
R7: 0x00000000
R8: 0x10000000
R9: 0x10000004
R10: 0x00000005
R11: 0x00000003
R12: 0x00000000
R13: 0x00000000
R14: 0x00000000
R15: 0x00000000
R16: 0xffffffff
R17: 0x00000000
R18: 0x00000000
R19: 0x00000000
R20: 0x00000000
R21: 0xffffffb8
R22: 0x00000000
R23: 0x00000000
R24: 0x00000000
R25: 0x00000000
R26: 0x00000000
R27: 0x00000000
R28: 0x00000000
R29: 0x00000000
R30: 0x00000000
R31: 0x00000000

Memory content [0x10000000..0x10000010] :
-------------------------------------
0x10000000: 0x0000012c
0x10000004: 0x000000c8
0x10000008: 0x00000000
0x1000000c: 0x00000000
0x10000010: 0x00000000

42th cycle
Current register values : 
-------------------------------------
PC: 0x0040004c
Register:
R0: 0x00000000
R1: 0x00000000
R2: 0x00000000
R3: 0xffffffd0
R4: 0xffffffd0
R5: 0x00000000
R6: 0x00000000
R7: 0x00000000
R8: 0x10000000
R9: 0x10000004
R10: 0x00000005
R11: 0x00000003
R12: 0x00000000
R13: 0x00000000
R14: 0x00000000
R15: 0x00000000
R16: 0xffffffff
R17: 0x00000000
R18: 0x00000000
R19: 0x00000000
R20: 0x00000000
R21: 0xffffffb8
R22: 0x00000000
R23: 0x00000000
R24: 0x00000000
R25: 0x00000000
R26: 0x00000000
R27: 0x00000000
R28: 0x00000000
R29: 0x00000000
R30: 0x00000000
R31: 0x00000000

Memory content [0x10000000..0x10000010] :
-------------------------------------
0x10000000: 0x0000012c
0x10000004: 0x000000c8
0x10000008: 0x00000000
0x1000000c: 0x00000000
0x10000010: 0x00000000

43th cycle
Current register values : 
-------------------------------------
PC: 0x00400020
Register:
R0: 0x00000000
R1: 0x00000000
R2: 0x00000000
R3: 0xffffffd0
R4: 0xffffffd0
R5: 0x00000000
R6: 0x00000000
R7: 0x00000000
R8: 0x10000000
R9: 0x10000004
R10: 0x00000005
R11: 0x00000003
R12: 0x00000000
R13: 0x00000000
R14: 0x00000000
R15: 0x00000000
R16: 0xffffffff
R17: 0x00000000
R18: 0x00000000
R19: 0x00000000
R20: 0x00000000
R21: 0xffffffb8
R22: 0x00000000
R23: 0x00000000
R24: 0x00000000
R25: 0x00000000
R26: 0x00000000
R27: 0x00000000
R28: 0x00000000
R29: 0x00000000
R30: 0x00000000
R31: 0x00000000

Memory content [0x10000000..0x10000010] :
-------------------------------------
0x10000000: 0x0000012c
0x10000004: 0x000000c8
0x10000008: 0x00000000
0x1000000c: 0x00000000
0x10000010: 0x00000000

44th cycle
Current register values : 
-------------------------------------
PC: 0x00400024
Register:
R0: 0x00000000
R1: 0x00000000
R2: 0x00000000
R3: 0xffffffd0
R4: 0xffffffd0
R5: 0x00000000
R6: 0x00000000
R7: 0x00000000
R8: 0x10000000
R9: 0x10000004
R10: 0x00000006
R11: 0x00000003
R12: 0x00000000
R13: 0x00000000
R14: 0x00000000
R15: 0x00000000
R16: 0xffffffff
R17: 0x00000000
R18: 0x00000000
R19: 0x00000000
R20: 0x00000000
R21: 0xffffffb8
R22: 0x00000000
R23: 0x00000000
R24: 0x00000000
R25: 0x00000000
R26: 0x00000000
R27: 0x00000000
R28: 0x00000000
R29: 0x00000000
R30: 0x00000000
R31: 0x00000000

Memory content [0x10000000..0x10000010] :
-------------------------------------
0x10000000: 0x0000012c
0x10000004: 0x000000c8
0x10000008: 0x00000000
0x1000000c: 0x00000000
0x10000010: 0x00000000

45th cycle
Current register values : 
-------------------------------------
PC: 0x00400028
Register:
R0: 0x00000000
R1: 0x00000000
R2: 0x00000000
R3: 0xffffffd0
R4: 0xffffffd0
R5: 0x00000000
R6: 0x00000000
R7: 0x00000000
R8: 0x10000000
R9: 0x10000004
R10: 0x00000006
R11: 0x00000003
R12: 0x00000000
R13: 0x00000000
R14: 0x00000000
R15: 0x00000000
R16: 0xffffffff
R17: 0x00000000
R18: 0x00000000
R19: 0x00000000
R20: 0x00000000
R21: 0xffffffa0
R22: 0x00000000
R23: 0x00000000
R24: 0x00000000
R25: 0x00000000
R26: 0x00000000
R27: 0x00000000
R28: 0x00000000
R29: 0x00000000
R30: 0x00000000
R31: 0x00000000

Memory content [0x10000000..0x10000010] :
-------------------------------------
0x10000000: 0x0000012c
0x10000004: 0x000000c8
0x10000008: 0x00000000
0x1000000c: 0x00000000
0x10000010: 0x00000000

46th cycle
Current register values : 
-------------------------------------
PC: 0x0040002c
Register:
R0: 0x00000000
R1: 0x00000000
R2: 0x00000000
R3: 0xffffffb8
R4: 0xffffffd0
R5: 0x00000000
R6: 0x00000000
R7: 0x00000000
R8: 0x10000000
R9: 0x10000004
R10: 0x00000006
R11: 0x00000003
R12: 0x00000000
R13: 0x00000000
R14: 0x00000000
R15: 0x00000000
R16: 0xffffffff
R17: 0x00000000
R18: 0x00000000
R19: 0x00000000
R20: 0x00000000
R21: 0xffffffa0
R22: 0x00000000
R23: 0x00000000
R24: 0x00000000
R25: 0x00000000
R26: 0x00000000
R27: 0x00000000
R28: 0x00000000
R29: 0x00000000
R30: 0x00000000
R31: 0x00000000

Memory content [0x10000000..0x10000010] :
-------------------------------------
0x10000000: 0x0000012c
0x10000004: 0x000000c8
0x10000008: 0x00000000
0x1000000c: 0x00000000
0x10000010: 0x00000000

47th cycle
Current register values : 
-------------------------------------
PC: 0x00400030
Register:
R0: 0x00000000
R1: 0x00000000
R2: 0x00000000
R3: 0xffffffb8
R4: 0xffffffb8
R5: 0x00000000
R6: 0x00000000
R7: 0x00000000
R8: 0x10000000
R9: 0x10000004
R10: 0x00000006
R11: 0x00000003
R12: 0x00000000
R13: 0x00000000
R14: 0x00000000
R15: 0x00000000
R16: 0xffffffff
R17: 0x00000000
R18: 0x00000000
R19: 0x00000000
R20: 0x00000000
R21: 0xffffffa0
R22: 0x00000000
R23: 0x00000000
R24: 0x00000000
R25: 0x00000000
R26: 0x00000000
R27: 0x00000000
R28: 0x00000000
R29: 0x00000000
R30: 0x00000000
R31: 0x00000000

Memory content [0x10000000..0x10000010] :
-------------------------------------
0x10000000: 0x0000012c
0x10000004: 0x000000c8
0x10000008: 0x00000000
0x1000000c: 0x00000000
0x10000010: 0x00000000

48th cycle
Current register values : 
-------------------------------------
PC: 0x00400034
Register:
R0: 0x00000000
R1: 0x00000000
R2: 0x00000000
R3: 0xffffffb8
R4: 0xffffffb8
R5: 0x00000000
R6: 0x00000000
R7: 0x00000000
R8: 0x10000000
R9: 0x10000004
R10: 0x00000006
R11: 0x00000004
R12: 0x00000000
R13: 0x00000000
R14: 0x00000000
R15: 0x00000000
R16: 0xffffffff
R17: 0x00000000
R18: 0x00000000
R19: 0x00000000
R20: 0x00000000
R21: 0xffffffa0
R22: 0x00000000
R23: 0x00000000
R24: 0x00000000
R25: 0x00000000
R26: 0x00000000
R27: 0x00000000
R28: 0x00000000
R29: 0x00000000
R30: 0x00000000
R31: 0x00000000

Memory content [0x10000000..0x10000010] :
-------------------------------------
0x10000000: 0x0000012c
0x10000004: 0x000000c8
0x10000008: 0x00000000
0x1000000c: 0x00000000
0x10000010: 0x00000000

49th cycle
Current register values : 
-------------------------------------
PC: 0x00400038
Register:
R0: 0x00000000
R1: 0x00000000
R2: 0x00000000
R3: 0xffffffb8
R4: 0xffffffb8
R5: 0x00000000
R6: 0x00000000
R7: 0x00000000
R8: 0x10000000
R9: 0x10000004
R10: 0x00000006
R11: 0x00000004
R12: 0x00000000
R13: 0x00000000
R14: 0x00000000
R15: 0x00000000
R16: 0xffffffff
R17: 0x00000000
R18: 0x00000000
R19: 0x00000000
R20: 0x00000000
R21: 0xffffffa0
R22: 0x00000000
R23: 0x00000000
R24: 0x00000000
R25: 0x00000000
R26: 0x00000000
R27: 0x00000000
R28: 0x00000000
R29: 0x00000000
R30: 0x00000000
R31: 0x00000000

Memory content [0x10000000..0x10000010] :
-------------------------------------
0x10000000: 0x0000012c
0x10000004: 0x000000c8
0x10000008: 0x00000000
0x1000000c: 0x00000000
0x10000010: 0x00000000

50th cycle
