Instruction Information
INST_INFO[ 0 ].value :  3c1d1000
INST_INFO[ 0 ].opcode :  15
INST_INFO[ 0 ].rs :  0
INST_INFO[ 0 ].rt :  29
INST_INFO[ 0 ].imm :  4096
INST_INFO[ 1 ].value :  37bd0004
INST_INFO[ 1 ].opcode :  13
INST_INFO[ 1 ].rs :  29
INST_INFO[ 1 ].rt :  29
INST_INFO[ 1 ].imm :  4
INST_INFO[ 2 ].value :  afbe0004
INST_INFO[ 2 ].opcode :  43
INST_INFO[ 2 ].rs :  29
INST_INFO[ 2 ].rt :  30
INST_INFO[ 2 ].imm :  4
INST_INFO[ 3 ].value :   3a0f021
INST_INFO[ 3 ].opcode :  0
INST_INFO[ 3 ].func_code :  33
INST_INFO[ 3 ].rs :  29
INST_INFO[ 3 ].rt :  0
INST_INFO[ 3 ].rd :  30
INST_INFO[ 3 ].shamt :  0
INST_INFO[ 4 ].value :  afc00008
INST_INFO[ 4 ].opcode :  43
INST_INFO[ 4 ].rs :  30
INST_INFO[ 4 ].rt :  0
INST_INFO[ 4 ].imm :  8
INST_INFO[ 5 ].value :  8fc20008
INST_INFO[ 5 ].opcode :  35
INST_INFO[ 5 ].rs :  30
INST_INFO[ 5 ].rt :  2
INST_INFO[ 5 ].imm :  8
INST_INFO[ 6 ].value :  2c420014
INST_INFO[ 6 ].opcode :  11
INST_INFO[ 6 ].rs :  2
INST_INFO[ 6 ].rt :  2
INST_INFO[ 6 ].imm :  20
INST_INFO[ 7 ].value :  1040000b
INST_INFO[ 7 ].opcode :  4
INST_INFO[ 7 ].rs :  2
INST_INFO[ 7 ].rt :  0
INST_INFO[ 7 ].imm :  11
INST_INFO[ 8 ].value :  3c041000
INST_INFO[ 8 ].opcode :  15
INST_INFO[ 8 ].rs :  0
INST_INFO[ 8 ].rt :  4
INST_INFO[ 8 ].imm :  4096
INST_INFO[ 9 ].value :  8c820000
INST_INFO[ 9 ].opcode :  35
INST_INFO[ 9 ].rs :  4
INST_INFO[ 9 ].rt :  2
INST_INFO[ 9 ].imm :  0
INST_INFO[ 10 ].value :  afc2000c
INST_INFO[ 10 ].opcode :  43
INST_INFO[ 10 ].rs :  30
INST_INFO[ 10 ].rt :  2
INST_INFO[ 10 ].imm :  12
INST_INFO[ 11 ].value :  8c830004
INST_INFO[ 11 ].opcode :  35
INST_INFO[ 11 ].rs :  4
INST_INFO[ 11 ].rt :  3
INST_INFO[ 11 ].imm :  4
INST_INFO[ 12 ].value :  ac830000
INST_INFO[ 12 ].opcode :  43
INST_INFO[ 12 ].rs :  4
INST_INFO[ 12 ].rt :  3
INST_INFO[ 12 ].imm :  0
INST_INFO[ 13 ].value :  8fc3000c
INST_INFO[ 13 ].opcode :  35
INST_INFO[ 13 ].rs :  30
INST_INFO[ 13 ].rt :  3
INST_INFO[ 13 ].imm :  12
INST_INFO[ 14 ].value :  ac830004
INST_INFO[ 14 ].opcode :  43
INST_INFO[ 14 ].rs :  4
INST_INFO[ 14 ].rt :  3
INST_INFO[ 14 ].imm :  4
INST_INFO[ 15 ].value :  8fc20008
INST_INFO[ 15 ].opcode :  35
INST_INFO[ 15 ].rs :  30
INST_INFO[ 15 ].rt :  2
INST_INFO[ 15 ].imm :  8
INST_INFO[ 16 ].value :  24420001
INST_INFO[ 16 ].opcode :  9
INST_INFO[ 16 ].rs :  2
INST_INFO[ 16 ].rt :  2
INST_INFO[ 16 ].imm :  1
INST_INFO[ 17 ].value :  afc20008
INST_INFO[ 17 ].opcode :  43
INST_INFO[ 17 ].rs :  30
INST_INFO[ 17 ].rt :  2
INST_INFO[ 17 ].imm :  8
INST_INFO[ 18 ].value :   8100005
INST_INFO[ 18 ].opcode :  2
INST_INFO[ 18 ].target :  1048581
INST_INFO[ 19 ].value :    401021
INST_INFO[ 19 ].opcode :  0
INST_INFO[ 19 ].func_code :  33
INST_INFO[ 19 ].rs :  2
INST_INFO[ 19 ].rt :  0
INST_INFO[ 19 ].rd :  2
INST_INFO[ 19 ].shamt :  0
INST_INFO[ 20 ].value :   3c0e821
INST_INFO[ 20 ].opcode :  0
INST_INFO[ 20 ].func_code :  33
INST_INFO[ 20 ].rs :  30
INST_INFO[ 20 ].rt :  0
INST_INFO[ 20 ].rd :  29
INST_INFO[ 20 ].shamt :  0
INST_INFO[ 21 ].value :  8fbe0014
INST_INFO[ 21 ].opcode :  35
INST_INFO[ 21 ].rs :  29
INST_INFO[ 21 ].rt :  30
INST_INFO[ 21 ].imm :  20
INST_INFO[ 22 ].value :  27bd0018
INST_INFO[ 22 ].opcode :  9
INST_INFO[ 22 ].rs :  29
INST_INFO[ 22 ].rt :  29
INST_INFO[ 22 ].imm :  24
Memory Dump - Text Segment

text_seg[ 0 ] :  3c1d1000
text_seg[ 4 ] :  37bd0004
text_seg[ 8 ] :  afbe0004
text_seg[ 12 ] :  3a0f021
text_seg[ 16 ] :  afc00008
text_seg[ 20 ] :  8fc20008
text_seg[ 24 ] :  2c420014
text_seg[ 28 ] :  1040000b
text_seg[ 32 ] :  3c041000
text_seg[ 36 ] :  8c820000
text_seg[ 40 ] :  afc2000c
text_seg[ 44 ] :  8c830004
text_seg[ 48 ] :  ac830000
text_seg[ 52 ] :  8fc3000c
text_seg[ 56 ] :  ac830004
text_seg[ 60 ] :  8fc20008
text_seg[ 64 ] :  24420001
text_seg[ 68 ] :  afc20008
text_seg[ 72 ] :  8100005
text_seg[ 76 ] :  401021
text_seg[ 80 ] :  3c0e821
text_seg[ 84 ] :  8fbe0014
text_seg[ 88 ] :  27bd0018
data_seg[ 0 ] :  1
data_seg[ 4 ] :  a
Current PC: 0
Simulating for 50 cycles...

Current register values : 
-------------------------------------
PC: 0x00400004
Register:
R0: 0x00000000
R1: 0x00000000
R2: 0x00000000
R3: 0x00000000
R4: 0x00000000
R5: 0x00000000
R6: 0x00000000
R7: 0x00000000
R8: 0x00000000
R9: 0x00000000
R10: 0x00000000
R11: 0x00000000
R12: 0x00000000
R13: 0x00000000
R14: 0x00000000
R15: 0x00000000
R16: 0x00000000
R17: 0x00000000
R18: 0x00000000
R19: 0x00000000
R20: 0x00000000
R21: 0x00000000
R22: 0x00000000
R23: 0x00000000
R24: 0x00000000
R25: 0x00000000
R26: 0x00000000
R27: 0x00000000
R28: 0x00000000
R29: 0x10000000
R30: 0x00000000
R31: 0x00000000

Memory content [0x10000000..0x10000010] :
-------------------------------------
0x10000000: 0x00000001
0x10000004: 0x0000000a
0x10000008: 0x00000000
0x1000000c: 0x00000000
0x10000010: 0x00000000

Current register values : 
-------------------------------------
PC: 0x00400008
Register:
R0: 0x00000000
R1: 0x00000000
R2: 0x00000000
R3: 0x00000000
R4: 0x00000000
R5: 0x00000000
R6: 0x00000000
R7: 0x00000000
R8: 0x00000000
R9: 0x00000000
R10: 0x00000000
R11: 0x00000000
R12: 0x00000000
R13: 0x00000000
R14: 0x00000000
R15: 0x00000000
R16: 0x00000000
R17: 0x00000000
R18: 0x00000000
R19: 0x00000000
R20: 0x00000000
R21: 0x00000000
R22: 0x00000000
R23: 0x00000000
R24: 0x00000000
R25: 0x00000000
R26: 0x00000000
R27: 0x00000000
R28: 0x00000000
R29: 0x10000004
R30: 0x00000000
R31: 0x00000000

Memory content [0x10000000..0x10000010] :
-------------------------------------
0x10000000: 0x00000001
0x10000004: 0x0000000a
0x10000008: 0x00000000
0x1000000c: 0x00000000
0x10000010: 0x00000000

Current register values : 
-------------------------------------
PC: 0x0040000c
Register:
R0: 0x00000000
R1: 0x00000000
R2: 0x00000000
R3: 0x00000000
R4: 0x00000000
R5: 0x00000000
R6: 0x00000000
R7: 0x00000000
R8: 0x00000000
R9: 0x00000000
R10: 0x00000000
R11: 0x00000000
R12: 0x00000000
R13: 0x00000000
R14: 0x00000000
R15: 0x00000000
R16: 0x00000000
R17: 0x00000000
R18: 0x00000000
R19: 0x00000000
R20: 0x00000000
R21: 0x00000000
R22: 0x00000000
R23: 0x00000000
R24: 0x00000000
R25: 0x00000000
R26: 0x00000000
R27: 0x00000000
R28: 0x00000000
R29: 0x10000004
R30: 0x00000000
R31: 0x00000000

Memory content [0x10000000..0x10000010] :
-------------------------------------
0x10000000: 0x00000001
0x10000004: 0x0000000a
0x10000008: 0x00000000
0x1000000c: 0x00000000
0x10000010: 0x00000000

Current register values : 
-------------------------------------
PC: 0x00400010
Register:
R0: 0x00000000
R1: 0x00000000
R2: 0x00000000
R3: 0x00000000
R4: 0x00000000
R5: 0x00000000
R6: 0x00000000
R7: 0x00000000
R8: 0x00000000
R9: 0x00000000
R10: 0x00000000
R11: 0x00000000
R12: 0x00000000
R13: 0x00000000
R14: 0x00000000
R15: 0x00000000
R16: 0x00000000
R17: 0x00000000
R18: 0x00000000
R19: 0x00000000
R20: 0x00000000
R21: 0x00000000
R22: 0x00000000
R23: 0x00000000
R24: 0x00000000
R25: 0x00000000
R26: 0x00000000
R27: 0x00000000
R28: 0x00000000
R29: 0x10000004
R30: 0x10000004
R31: 0x00000000

Memory content [0x10000000..0x10000010] :
-------------------------------------
0x10000000: 0x00000001
0x10000004: 0x0000000a
0x10000008: 0x00000000
0x1000000c: 0x00000000
0x10000010: 0x00000000

Current register values : 
-------------------------------------
PC: 0x00400014
Register:
R0: 0x00000000
R1: 0x00000000
R2: 0x00000000
R3: 0x00000000
R4: 0x00000000
R5: 0x00000000
R6: 0x00000000
R7: 0x00000000
R8: 0x00000000
R9: 0x00000000
R10: 0x00000000
R11: 0x00000000
R12: 0x00000000
R13: 0x00000000
R14: 0x00000000
R15: 0x00000000
R16: 0x00000000
R17: 0x00000000
R18: 0x00000000
R19: 0x00000000
R20: 0x00000000
R21: 0x00000000
R22: 0x00000000
R23: 0x00000000
R24: 0x00000000
R25: 0x00000000
R26: 0x00000000
R27: 0x00000000
R28: 0x00000000
R29: 0x10000004
R30: 0x10000004
R31: 0x00000000

Memory content [0x10000000..0x10000010] :
-------------------------------------
0x10000000: 0x00000001
0x10000004: 0x0000000a
0x10000008: 0x00000000
0x1000000c: 0x00000000
0x10000010: 0x00000000

Current register values : 
-------------------------------------
PC: 0x00400018
Register:
R0: 0x00000000
R1: 0x00000000
R2: 0x00000000
R3: 0x00000000
R4: 0x00000000
R5: 0x00000000
R6: 0x00000000
R7: 0x00000000
R8: 0x00000000
R9: 0x00000000
R10: 0x00000000
R11: 0x00000000
R12: 0x00000000
R13: 0x00000000
R14: 0x00000000
R15: 0x00000000
R16: 0x00000000
R17: 0x00000000
R18: 0x00000000
R19: 0x00000000
R20: 0x00000000
R21: 0x00000000
R22: 0x00000000
R23: 0x00000000
R24: 0x00000000
R25: 0x00000000
R26: 0x00000000
R27: 0x00000000
R28: 0x00000000
R29: 0x10000004
R30: 0x10000004
R31: 0x00000000

Memory content [0x10000000..0x10000010] :
-------------------------------------
0x10000000: 0x00000001
0x10000004: 0x0000000a
0x10000008: 0x00000000
0x1000000c: 0x00000000
0x10000010: 0x00000000

Current register values : 
-------------------------------------
PC: 0x0040001c
Register:
R0: 0x00000000
R1: 0x00000000
R2: 0x00000001
R3: 0x00000000
R4: 0x00000000
R5: 0x00000000
R6: 0x00000000
R7: 0x00000000
R8: 0x00000000
R9: 0x00000000
R10: 0x00000000
R11: 0x00000000
R12: 0x00000000
R13: 0x00000000
R14: 0x00000000
R15: 0x00000000
R16: 0x00000000
R17: 0x00000000
R18: 0x00000000
R19: 0x00000000
R20: 0x00000000
R21: 0x00000000
R22: 0x00000000
R23: 0x00000000
R24: 0x00000000
R25: 0x00000000
R26: 0x00000000
R27: 0x00000000
R28: 0x00000000
R29: 0x10000004
R30: 0x10000004
R31: 0x00000000

Memory content [0x10000000..0x10000010] :
-------------------------------------
0x10000000: 0x00000001
0x10000004: 0x0000000a
0x10000008: 0x00000000
0x1000000c: 0x00000000
0x10000010: 0x00000000

Current register values : 
-------------------------------------
PC: 0x00400020
Register:
R0: 0x00000000
R1: 0x00000000
R2: 0x00000001
R3: 0x00000000
R4: 0x00000000
R5: 0x00000000
R6: 0x00000000
R7: 0x00000000
R8: 0x00000000
R9: 0x00000000
R10: 0x00000000
R11: 0x00000000
R12: 0x00000000
R13: 0x00000000
R14: 0x00000000
R15: 0x00000000
R16: 0x00000000
R17: 0x00000000
R18: 0x00000000
R19: 0x00000000
R20: 0x00000000
R21: 0x00000000
R22: 0x00000000
R23: 0x00000000
R24: 0x00000000
R25: 0x00000000
R26: 0x00000000
R27: 0x00000000
R28: 0x00000000
R29: 0x10000004
R30: 0x10000004
R31: 0x00000000

Memory content [0x10000000..0x10000010] :
-------------------------------------
0x10000000: 0x00000001
0x10000004: 0x0000000a
0x10000008: 0x00000000
0x1000000c: 0x00000000
0x10000010: 0x00000000

Current register values : 
-------------------------------------
PC: 0x00400024
Register:
R0: 0x00000000
R1: 0x00000000
R2: 0x00000001
R3: 0x00000000
R4: 0x10000000
R5: 0x00000000
R6: 0x00000000
R7: 0x00000000
R8: 0x00000000
R9: 0x00000000
R10: 0x00000000
R11: 0x00000000
R12: 0x00000000
R13: 0x00000000
R14: 0x00000000
R15: 0x00000000
R16: 0x00000000
R17: 0x00000000
R18: 0x00000000
R19: 0x00000000
R20: 0x00000000
R21: 0x00000000
R22: 0x00000000
R23: 0x00000000
R24: 0x00000000
R25: 0x00000000
R26: 0x00000000
R27: 0x00000000
R28: 0x00000000
R29: 0x10000004
R30: 0x10000004
R31: 0x00000000

Memory content [0x10000000..0x10000010] :
-------------------------------------
0x10000000: 0x00000001
0x10000004: 0x0000000a
0x10000008: 0x00000000
0x1000000c: 0x00000000
0x10000010: 0x00000000

Current register values : 
-------------------------------------
PC: 0x00400028
Register:
R0: 0x00000000
R1: 0x00000000
R2: 0x00000001
R3: 0x00000000
R4: 0x10000000
R5: 0x00000000
R6: 0x00000000
R7: 0x00000000
R8: 0x00000000
R9: 0x00000000
R10: 0x00000000
R11: 0x00000000
R12: 0x00000000
R13: 0x00000000
R14: 0x00000000
R15: 0x00000000
R16: 0x00000000
R17: 0x00000000
R18: 0x00000000
R19: 0x00000000
R20: 0x00000000
R21: 0x00000000
R22: 0x00000000
R23: 0x00000000
R24: 0x00000000
R25: 0x00000000
R26: 0x00000000
R27: 0x00000000
R28: 0x00000000
R29: 0x10000004
R30: 0x10000004
R31: 0x00000000

Memory content [0x10000000..0x10000010] :
-------------------------------------
0x10000000: 0x00000001
0x10000004: 0x0000000a
0x10000008: 0x00000000
0x1000000c: 0x00000000
0x10000010: 0x00000000

Current register values : 
-------------------------------------
PC: 0x0040002c
Register:
R0: 0x00000000
R1: 0x00000000
R2: 0x00000001
R3: 0x00000000
R4: 0x10000000
R5: 0x00000000
R6: 0x00000000
R7: 0x00000000
R8: 0x00000000
R9: 0x00000000
R10: 0x00000000
R11: 0x00000000
R12: 0x00000000
R13: 0x00000000
R14: 0x00000000
R15: 0x00000000
R16: 0x00000000
R17: 0x00000000
R18: 0x00000000
R19: 0x00000000
R20: 0x00000000
R21: 0x00000000
R22: 0x00000000
R23: 0x00000000
R24: 0x00000000
R25: 0x00000000
R26: 0x00000000
R27: 0x00000000
R28: 0x00000000
R29: 0x10000004
R30: 0x10000004
R31: 0x00000000

Memory content [0x10000000..0x10000010] :
-------------------------------------
0x10000000: 0x00000001
0x10000004: 0x0000000a
0x10000008: 0x00000000
0x1000000c: 0x00000000
0x10000010: 0x00000001

Current register values : 
-------------------------------------
PC: 0x00400030
Register:
R0: 0x00000000
R1: 0x00000000
R2: 0x00000001
R3: 0x0000000a
R4: 0x10000000
R5: 0x00000000
R6: 0x00000000
R7: 0x00000000
R8: 0x00000000
R9: 0x00000000
R10: 0x00000000
R11: 0x00000000
R12: 0x00000000
R13: 0x00000000
R14: 0x00000000
R15: 0x00000000
R16: 0x00000000
R17: 0x00000000
R18: 0x00000000
R19: 0x00000000
R20: 0x00000000
R21: 0x00000000
R22: 0x00000000
R23: 0x00000000
R24: 0x00000000
R25: 0x00000000
R26: 0x00000000
R27: 0x00000000
R28: 0x00000000
R29: 0x10000004
R30: 0x10000004
R31: 0x00000000

Memory content [0x10000000..0x10000010] :
-------------------------------------
0x10000000: 0x00000001
0x10000004: 0x0000000a
0x10000008: 0x00000000
0x1000000c: 0x00000000
0x10000010: 0x00000001

Current register values : 
-------------------------------------
PC: 0x00400034
Register:
R0: 0x00000000
R1: 0x00000000
R2: 0x00000001
R3: 0x0000000a
R4: 0x10000000
R5: 0x00000000
R6: 0x00000000
R7: 0x00000000
R8: 0x00000000
R9: 0x00000000
R10: 0x00000000
R11: 0x00000000
R12: 0x00000000
R13: 0x00000000
R14: 0x00000000
R15: 0x00000000
R16: 0x00000000
R17: 0x00000000
R18: 0x00000000
R19: 0x00000000
R20: 0x00000000
R21: 0x00000000
R22: 0x00000000
R23: 0x00000000
R24: 0x00000000
R25: 0x00000000
R26: 0x00000000
R27: 0x00000000
R28: 0x00000000
R29: 0x10000004
R30: 0x10000004
R31: 0x00000000

Memory content [0x10000000..0x10000010] :
-------------------------------------
0x10000000: 0x0000000a
0x10000004: 0x0000000a
0x10000008: 0x00000000
0x1000000c: 0x00000000
0x10000010: 0x00000001

Current register values : 
-------------------------------------
PC: 0x00400038
Register:
R0: 0x00000000
R1: 0x00000000
R2: 0x00000001
R3: 0x00000001
R4: 0x10000000
R5: 0x00000000
R6: 0x00000000
R7: 0x00000000
R8: 0x00000000
R9: 0x00000000
R10: 0x00000000
R11: 0x00000000
R12: 0x00000000
R13: 0x00000000
R14: 0x00000000
R15: 0x00000000
R16: 0x00000000
R17: 0x00000000
R18: 0x00000000
R19: 0x00000000
R20: 0x00000000
R21: 0x00000000
R22: 0x00000000
R23: 0x00000000
R24: 0x00000000
R25: 0x00000000
R26: 0x00000000
R27: 0x00000000
R28: 0x00000000
R29: 0x10000004
R30: 0x10000004
R31: 0x00000000

Memory content [0x10000000..0x10000010] :
-------------------------------------
0x10000000: 0x0000000a
0x10000004: 0x0000000a
0x10000008: 0x00000000
0x1000000c: 0x00000000
0x10000010: 0x00000001

Current register values : 
-------------------------------------
PC: 0x0040003c
Register:
R0: 0x00000000
R1: 0x00000000
R2: 0x00000001
R3: 0x00000001
R4: 0x10000000
R5: 0x00000000
R6: 0x00000000
R7: 0x00000000
R8: 0x00000000
R9: 0x00000000
R10: 0x00000000
R11: 0x00000000
R12: 0x00000000
R13: 0x00000000
R14: 0x00000000
R15: 0x00000000
R16: 0x00000000
R17: 0x00000000
R18: 0x00000000
R19: 0x00000000
R20: 0x00000000
R21: 0x00000000
R22: 0x00000000
R23: 0x00000000
R24: 0x00000000
R25: 0x00000000
R26: 0x00000000
R27: 0x00000000
R28: 0x00000000
R29: 0x10000004
R30: 0x10000004
R31: 0x00000000

Memory content [0x10000000..0x10000010] :
-------------------------------------
0x10000000: 0x0000000a
0x10000004: 0x00000001
0x10000008: 0x00000000
0x1000000c: 0x00000000
0x10000010: 0x00000001

Current register values : 
-------------------------------------
PC: 0x00400040
Register:
R0: 0x00000000
R1: 0x00000000
R2: 0x00000000
R3: 0x00000001
R4: 0x10000000
R5: 0x00000000
R6: 0x00000000
R7: 0x00000000
R8: 0x00000000
R9: 0x00000000
R10: 0x00000000
R11: 0x00000000
R12: 0x00000000
R13: 0x00000000
R14: 0x00000000
R15: 0x00000000
R16: 0x00000000
R17: 0x00000000
R18: 0x00000000
R19: 0x00000000
R20: 0x00000000
R21: 0x00000000
R22: 0x00000000
R23: 0x00000000
R24: 0x00000000
R25: 0x00000000
R26: 0x00000000
R27: 0x00000000
R28: 0x00000000
R29: 0x10000004
R30: 0x10000004
R31: 0x00000000

Memory content [0x10000000..0x10000010] :
-------------------------------------
0x10000000: 0x0000000a
0x10000004: 0x00000001
0x10000008: 0x00000000
0x1000000c: 0x00000000
0x10000010: 0x00000001

Current register values : 
-------------------------------------
PC: 0x00400044
Register:
R0: 0x00000000
R1: 0x00000000
R2: 0x00000001
R3: 0x00000001
R4: 0x10000000
R5: 0x00000000
R6: 0x00000000
R7: 0x00000000
R8: 0x00000000
R9: 0x00000000
R10: 0x00000000
R11: 0x00000000
R12: 0x00000000
R13: 0x00000000
R14: 0x00000000
R15: 0x00000000
R16: 0x00000000
R17: 0x00000000
R18: 0x00000000
R19: 0x00000000
R20: 0x00000000
R21: 0x00000000
R22: 0x00000000
R23: 0x00000000
R24: 0x00000000
R25: 0x00000000
R26: 0x00000000
R27: 0x00000000
R28: 0x00000000
R29: 0x10000004
R30: 0x10000004
R31: 0x00000000

Memory content [0x10000000..0x10000010] :
-------------------------------------
0x10000000: 0x0000000a
0x10000004: 0x00000001
0x10000008: 0x00000000
0x1000000c: 0x00000000
0x10000010: 0x00000001

Current register values : 
-------------------------------------
PC: 0x00400048
Register:
R0: 0x00000000
R1: 0x00000000
R2: 0x00000001
R3: 0x00000001
R4: 0x10000000
R5: 0x00000000
R6: 0x00000000
R7: 0x00000000
R8: 0x00000000
R9: 0x00000000
R10: 0x00000000
R11: 0x00000000
R12: 0x00000000
R13: 0x00000000
R14: 0x00000000
R15: 0x00000000
R16: 0x00000000
R17: 0x00000000
R18: 0x00000000
R19: 0x00000000
R20: 0x00000000
R21: 0x00000000
R22: 0x00000000
R23: 0x00000000
R24: 0x00000000
R25: 0x00000000
R26: 0x00000000
R27: 0x00000000
R28: 0x00000000
R29: 0x10000004
R30: 0x10000004
R31: 0x00000000

Memory content [0x10000000..0x10000010] :
-------------------------------------
0x10000000: 0x0000000a
0x10000004: 0x00000001
0x10000008: 0x00000000
0x1000000c: 0x00000001
0x10000010: 0x00000001

Current register values : 
-------------------------------------
PC: 0x00400014
Register:
R0: 0x00000000
R1: 0x00000000
R2: 0x00000001
R3: 0x00000001
R4: 0x10000000
R5: 0x00000000
R6: 0x00000000
R7: 0x00000000
R8: 0x00000000
R9: 0x00000000
R10: 0x00000000
R11: 0x00000000
R12: 0x00000000
R13: 0x00000000
R14: 0x00000000
R15: 0x00000000
R16: 0x00000000
R17: 0x00000000
R18: 0x00000000
R19: 0x00000000
R20: 0x00000000
R21: 0x00000000
R22: 0x00000000
R23: 0x00000000
R24: 0x00000000
R25: 0x00000000
R26: 0x00000000
R27: 0x00000000
R28: 0x00000000
R29: 0x10000004
R30: 0x10000004
R31: 0x00000000

Memory content [0x10000000..0x10000010] :
-------------------------------------
0x10000000: 0x0000000a
0x10000004: 0x00000001
0x10000008: 0x00000000
0x1000000c: 0x00000001
0x10000010: 0x00000001

Current register values : 
-------------------------------------
PC: 0x00400018
Register:
R0: 0x00000000
R1: 0x00000000
R2: 0x00000001
R3: 0x00000001
R4: 0x10000000
R5: 0x00000000
R6: 0x00000000
R7: 0x00000000
R8: 0x00000000
R9: 0x00000000
R10: 0x00000000
R11: 0x00000000
R12: 0x00000000
R13: 0x00000000
R14: 0x00000000
R15: 0x00000000
R16: 0x00000000
R17: 0x00000000
R18: 0x00000000
R19: 0x00000000
R20: 0x00000000
R21: 0x00000000
R22: 0x00000000
R23: 0x00000000
R24: 0x00000000
R25: 0x00000000
R26: 0x00000000
R27: 0x00000000
R28: 0x00000000
R29: 0x10000004
R30: 0x10000004
R31: 0x00000000

Memory content [0x10000000..0x10000010] :
-------------------------------------
0x10000000: 0x0000000a
0x10000004: 0x00000001
0x10000008: 0x00000000
0x1000000c: 0x00000001
0x10000010: 0x00000001

Current register values : 
-------------------------------------
PC: 0x0040001c
Register:
R0: 0x00000000
R1: 0x00000000
R2: 0x00000001
R3: 0x00000001
R4: 0x10000000
R5: 0x00000000
R6: 0x00000000
R7: 0x00000000
R8: 0x00000000
R9: 0x00000000
R10: 0x00000000
R11: 0x00000000
R12: 0x00000000
R13: 0x00000000
R14: 0x00000000
R15: 0x00000000
R16: 0x00000000
R17: 0x00000000
R18: 0x00000000
R19: 0x00000000
R20: 0x00000000
R21: 0x00000000
R22: 0x00000000
R23: 0x00000000
R24: 0x00000000
R25: 0x00000000
R26: 0x00000000
R27: 0x00000000
R28: 0x00000000
R29: 0x10000004
R30: 0x10000004
R31: 0x00000000

Memory content [0x10000000..0x10000010] :
-------------------------------------
0x10000000: 0x0000000a
0x10000004: 0x00000001
0x10000008: 0x00000000
0x1000000c: 0x00000001
0x10000010: 0x00000001

Current register values : 
-------------------------------------
PC: 0x00400020
Register:
R0: 0x00000000
R1: 0x00000000
R2: 0x00000001
R3: 0x00000001
R4: 0x10000000
R5: 0x00000000
R6: 0x00000000
R7: 0x00000000
R8: 0x00000000
R9: 0x00000000
R10: 0x00000000
R11: 0x00000000
R12: 0x00000000
R13: 0x00000000
R14: 0x00000000
R15: 0x00000000
R16: 0x00000000
R17: 0x00000000
R18: 0x00000000
R19: 0x00000000
R20: 0x00000000
R21: 0x00000000
R22: 0x00000000
R23: 0x00000000
R24: 0x00000000
R25: 0x00000000
R26: 0x00000000
R27: 0x00000000
R28: 0x00000000
R29: 0x10000004
R30: 0x10000004
R31: 0x00000000

Memory content [0x10000000..0x10000010] :
-------------------------------------
0x10000000: 0x0000000a
0x10000004: 0x00000001
0x10000008: 0x00000000
0x1000000c: 0x00000001
0x10000010: 0x00000001

Current register values : 
-------------------------------------
PC: 0x00400024
Register:
R0: 0x00000000
R1: 0x00000000
R2: 0x00000001
R3: 0x00000001
R4: 0x10000000
R5: 0x00000000
R6: 0x00000000
R7: 0x00000000
R8: 0x00000000
R9: 0x00000000
R10: 0x00000000
R11: 0x00000000
R12: 0x00000000
R13: 0x00000000
R14: 0x00000000
R15: 0x00000000
R16: 0x00000000
R17: 0x00000000
R18: 0x00000000
R19: 0x00000000
R20: 0x00000000
R21: 0x00000000
R22: 0x00000000
R23: 0x00000000
R24: 0x00000000
R25: 0x00000000
R26: 0x00000000
R27: 0x00000000
R28: 0x00000000
R29: 0x10000004
R30: 0x10000004
R31: 0x00000000

Memory content [0x10000000..0x10000010] :
-------------------------------------
0x10000000: 0x0000000a
0x10000004: 0x00000001
0x10000008: 0x00000000
0x1000000c: 0x00000001
0x10000010: 0x00000001

Current register values : 
-------------------------------------
PC: 0x00400028
Register:
R0: 0x00000000
R1: 0x00000000
R2: 0x0000000a
R3: 0x00000001
R4: 0x10000000
R5: 0x00000000
R6: 0x00000000
R7: 0x00000000
R8: 0x00000000
R9: 0x00000000
R10: 0x00000000
R11: 0x00000000
R12: 0x00000000
R13: 0x00000000
R14: 0x00000000
R15: 0x00000000
R16: 0x00000000
R17: 0x00000000
R18: 0x00000000
R19: 0x00000000
R20: 0x00000000
R21: 0x00000000
R22: 0x00000000
R23: 0x00000000
R24: 0x00000000
R25: 0x00000000
R26: 0x00000000
R27: 0x00000000
R28: 0x00000000
R29: 0x10000004
R30: 0x10000004
R31: 0x00000000

Memory content [0x10000000..0x10000010] :
-------------------------------------
0x10000000: 0x0000000a
0x10000004: 0x00000001
0x10000008: 0x00000000
0x1000000c: 0x00000001
0x10000010: 0x00000001

Current register values : 
-------------------------------------
PC: 0x0040002c
Register:
R0: 0x00000000
R1: 0x00000000
R2: 0x0000000a
R3: 0x00000001
R4: 0x10000000
R5: 0x00000000
R6: 0x00000000
R7: 0x00000000
R8: 0x00000000
R9: 0x00000000
R10: 0x00000000
R11: 0x00000000
R12: 0x00000000
R13: 0x00000000
R14: 0x00000000
R15: 0x00000000
R16: 0x00000000
R17: 0x00000000
R18: 0x00000000
R19: 0x00000000
R20: 0x00000000
R21: 0x00000000
R22: 0x00000000
R23: 0x00000000
R24: 0x00000000
R25: 0x00000000
R26: 0x00000000
R27: 0x00000000
R28: 0x00000000
R29: 0x10000004
R30: 0x10000004
R31: 0x00000000

Memory content [0x10000000..0x10000010] :
-------------------------------------
0x10000000: 0x0000000a
0x10000004: 0x00000001
0x10000008: 0x00000000
0x1000000c: 0x00000001
0x10000010: 0x0000000a

Current register values : 
-------------------------------------
PC: 0x00400030
Register:
R0: 0x00000000
R1: 0x00000000
R2: 0x0000000a
R3: 0x00000001
R4: 0x10000000
R5: 0x00000000
R6: 0x00000000
R7: 0x00000000
R8: 0x00000000
R9: 0x00000000
R10: 0x00000000
R11: 0x00000000
R12: 0x00000000
R13: 0x00000000
R14: 0x00000000
R15: 0x00000000
R16: 0x00000000
R17: 0x00000000
R18: 0x00000000
R19: 0x00000000
R20: 0x00000000
R21: 0x00000000
R22: 0x00000000
R23: 0x00000000
R24: 0x00000000
R25: 0x00000000
R26: 0x00000000
R27: 0x00000000
R28: 0x00000000
R29: 0x10000004
R30: 0x10000004
R31: 0x00000000

Memory content [0x10000000..0x10000010] :
-------------------------------------
0x10000000: 0x0000000a
0x10000004: 0x00000001
0x10000008: 0x00000000
0x1000000c: 0x00000001
0x10000010: 0x0000000a

Current register values : 
-------------------------------------
PC: 0x00400034
Register:
R0: 0x00000000
R1: 0x00000000
R2: 0x0000000a
R3: 0x00000001
R4: 0x10000000
R5: 0x00000000
R6: 0x00000000
R7: 0x00000000
R8: 0x00000000
R9: 0x00000000
R10: 0x00000000
R11: 0x00000000
R12: 0x00000000
R13: 0x00000000
R14: 0x00000000
R15: 0x00000000
R16: 0x00000000
R17: 0x00000000
R18: 0x00000000
R19: 0x00000000
R20: 0x00000000
R21: 0x00000000
R22: 0x00000000
R23: 0x00000000
R24: 0x00000000
R25: 0x00000000
R26: 0x00000000
R27: 0x00000000
R28: 0x00000000
R29: 0x10000004
R30: 0x10000004
R31: 0x00000000

Memory content [0x10000000..0x10000010] :
-------------------------------------
0x10000000: 0x00000001
0x10000004: 0x00000001
0x10000008: 0x00000000
0x1000000c: 0x00000001
0x10000010: 0x0000000a

Current register values : 
-------------------------------------
PC: 0x00400038
Register:
R0: 0x00000000
R1: 0x00000000
R2: 0x0000000a
R3: 0x0000000a
R4: 0x10000000
R5: 0x00000000
R6: 0x00000000
R7: 0x00000000
R8: 0x00000000
R9: 0x00000000
R10: 0x00000000
R11: 0x00000000
R12: 0x00000000
R13: 0x00000000
R14: 0x00000000
R15: 0x00000000
R16: 0x00000000
R17: 0x00000000
R18: 0x00000000
R19: 0x00000000
R20: 0x00000000
R21: 0x00000000
R22: 0x00000000
R23: 0x00000000
R24: 0x00000000
R25: 0x00000000
R26: 0x00000000
R27: 0x00000000
R28: 0x00000000
R29: 0x10000004
R30: 0x10000004
R31: 0x00000000

Memory content [0x10000000..0x10000010] :
-------------------------------------
0x10000000: 0x00000001
0x10000004: 0x00000001
0x10000008: 0x00000000
0x1000000c: 0x00000001
0x10000010: 0x0000000a

Current register values : 
-------------------------------------
PC: 0x0040003c
Register:
R0: 0x00000000
R1: 0x00000000
R2: 0x0000000a
R3: 0x0000000a
R4: 0x10000000
R5: 0x00000000
R6: 0x00000000
R7: 0x00000000
R8: 0x00000000
R9: 0x00000000
R10: 0x00000000
R11: 0x00000000
R12: 0x00000000
R13: 0x00000000
R14: 0x00000000
R15: 0x00000000
R16: 0x00000000
R17: 0x00000000
R18: 0x00000000
R19: 0x00000000
R20: 0x00000000
R21: 0x00000000
R22: 0x00000000
R23: 0x00000000
R24: 0x00000000
R25: 0x00000000
R26: 0x00000000
R27: 0x00000000
R28: 0x00000000
R29: 0x10000004
R30: 0x10000004
R31: 0x00000000

Memory content [0x10000000..0x10000010] :
-------------------------------------
0x10000000: 0x00000001
0x10000004: 0x0000000a
0x10000008: 0x00000000
0x1000000c: 0x00000001
0x10000010: 0x0000000a

Current register values : 
-------------------------------------
PC: 0x00400040
Register:
R0: 0x00000000
R1: 0x00000000
R2: 0x00000001
R3: 0x0000000a
R4: 0x10000000
R5: 0x00000000
R6: 0x00000000
R7: 0x00000000
R8: 0x00000000
R9: 0x00000000
R10: 0x00000000
R11: 0x00000000
R12: 0x00000000
R13: 0x00000000
R14: 0x00000000
R15: 0x00000000
R16: 0x00000000
R17: 0x00000000
R18: 0x00000000
R19: 0x00000000
R20: 0x00000000
R21: 0x00000000
R22: 0x00000000
R23: 0x00000000
R24: 0x00000000
R25: 0x00000000
R26: 0x00000000
R27: 0x00000000
R28: 0x00000000
R29: 0x10000004
R30: 0x10000004
R31: 0x00000000

Memory content [0x10000000..0x10000010] :
-------------------------------------
0x10000000: 0x00000001
0x10000004: 0x0000000a
0x10000008: 0x00000000
0x1000000c: 0x00000001
0x10000010: 0x0000000a

Current register values : 
-------------------------------------
PC: 0x00400044
Register:
R0: 0x00000000
R1: 0x00000000
R2: 0x00000002
R3: 0x0000000a
R4: 0x10000000
R5: 0x00000000
R6: 0x00000000
R7: 0x00000000
R8: 0x00000000
R9: 0x00000000
R10: 0x00000000
R11: 0x00000000
R12: 0x00000000
R13: 0x00000000
R14: 0x00000000
R15: 0x00000000
R16: 0x00000000
R17: 0x00000000
R18: 0x00000000
R19: 0x00000000
R20: 0x00000000
R21: 0x00000000
R22: 0x00000000
R23: 0x00000000
R24: 0x00000000
R25: 0x00000000
R26: 0x00000000
R27: 0x00000000
R28: 0x00000000
R29: 0x10000004
R30: 0x10000004
R31: 0x00000000

Memory content [0x10000000..0x10000010] :
-------------------------------------
0x10000000: 0x00000001
0x10000004: 0x0000000a
0x10000008: 0x00000000
0x1000000c: 0x00000001
0x10000010: 0x0000000a

Current register values : 
-------------------------------------
PC: 0x00400048
Register:
R0: 0x00000000
R1: 0x00000000
R2: 0x00000002
R3: 0x0000000a
R4: 0x10000000
R5: 0x00000000
R6: 0x00000000
R7: 0x00000000
R8: 0x00000000
R9: 0x00000000
R10: 0x00000000
R11: 0x00000000
R12: 0x00000000
R13: 0x00000000
R14: 0x00000000
R15: 0x00000000
R16: 0x00000000
R17: 0x00000000
R18: 0x00000000
R19: 0x00000000
R20: 0x00000000
R21: 0x00000000
R22: 0x00000000
R23: 0x00000000
R24: 0x00000000
R25: 0x00000000
R26: 0x00000000
R27: 0x00000000
R28: 0x00000000
R29: 0x10000004
R30: 0x10000004
R31: 0x00000000

Memory content [0x10000000..0x10000010] :
-------------------------------------
0x10000000: 0x00000001
0x10000004: 0x0000000a
0x10000008: 0x00000000
0x1000000c: 0x00000002
0x10000010: 0x0000000a

Current register values : 
-------------------------------------
PC: 0x00400014
Register:
R0: 0x00000000
R1: 0x00000000
R2: 0x00000002
R3: 0x0000000a
R4: 0x10000000
R5: 0x00000000
R6: 0x00000000
R7: 0x00000000
R8: 0x00000000
R9: 0x00000000
R10: 0x00000000
R11: 0x00000000
R12: 0x00000000
R13: 0x00000000
R14: 0x00000000
R15: 0x00000000
R16: 0x00000000
R17: 0x00000000
R18: 0x00000000
R19: 0x00000000
R20: 0x00000000
R21: 0x00000000
R22: 0x00000000
R23: 0x00000000
R24: 0x00000000
R25: 0x00000000
R26: 0x00000000
R27: 0x00000000
R28: 0x00000000
R29: 0x10000004
R30: 0x10000004
R31: 0x00000000

Memory content [0x10000000..0x10000010] :
-------------------------------------
0x10000000: 0x00000001
0x10000004: 0x0000000a
0x10000008: 0x00000000
0x1000000c: 0x00000002
0x10000010: 0x0000000a

Current register values : 
-------------------------------------
PC: 0x00400018
Register:
R0: 0x00000000
R1: 0x00000000
R2: 0x00000002
R3: 0x0000000a
R4: 0x10000000
R5: 0x00000000
R6: 0x00000000
R7: 0x00000000
R8: 0x00000000
R9: 0x00000000
R10: 0x00000000
R11: 0x00000000
R12: 0x00000000
R13: 0x00000000
R14: 0x00000000
R15: 0x00000000
R16: 0x00000000
R17: 0x00000000
R18: 0x00000000
R19: 0x00000000
R20: 0x00000000
R21: 0x00000000
R22: 0x00000000
R23: 0x00000000
R24: 0x00000000
R25: 0x00000000
R26: 0x00000000
R27: 0x00000000
R28: 0x00000000
R29: 0x10000004
R30: 0x10000004
R31: 0x00000000

Memory content [0x10000000..0x10000010] :
-------------------------------------
0x10000000: 0x00000001
0x10000004: 0x0000000a
0x10000008: 0x00000000
0x1000000c: 0x00000002
0x10000010: 0x0000000a

Current register values : 
-------------------------------------
PC: 0x0040001c
Register:
R0: 0x00000000
R1: 0x00000000
R2: 0x00000001
R3: 0x0000000a
R4: 0x10000000
R5: 0x00000000
R6: 0x00000000
R7: 0x00000000
R8: 0x00000000
R9: 0x00000000
R10: 0x00000000
R11: 0x00000000
R12: 0x00000000
R13: 0x00000000
R14: 0x00000000
R15: 0x00000000
R16: 0x00000000
R17: 0x00000000
R18: 0x00000000
R19: 0x00000000
R20: 0x00000000
R21: 0x00000000
R22: 0x00000000
R23: 0x00000000
R24: 0x00000000
R25: 0x00000000
R26: 0x00000000
R27: 0x00000000
R28: 0x00000000
R29: 0x10000004
R30: 0x10000004
R31: 0x00000000

Memory content [0x10000000..0x10000010] :
-------------------------------------
0x10000000: 0x00000001
0x10000004: 0x0000000a
0x10000008: 0x00000000
0x1000000c: 0x00000002
0x10000010: 0x0000000a

Current register values : 
-------------------------------------
PC: 0x00400020
Register:
R0: 0x00000000
R1: 0x00000000
R2: 0x00000001
R3: 0x0000000a
R4: 0x10000000
R5: 0x00000000
R6: 0x00000000
R7: 0x00000000
R8: 0x00000000
R9: 0x00000000
R10: 0x00000000
R11: 0x00000000
R12: 0x00000000
R13: 0x00000000
R14: 0x00000000
R15: 0x00000000
R16: 0x00000000
R17: 0x00000000
R18: 0x00000000
R19: 0x00000000
R20: 0x00000000
R21: 0x00000000
R22: 0x00000000
R23: 0x00000000
R24: 0x00000000
R25: 0x00000000
R26: 0x00000000
R27: 0x00000000
R28: 0x00000000
R29: 0x10000004
R30: 0x10000004
R31: 0x00000000

Memory content [0x10000000..0x10000010] :
-------------------------------------
0x10000000: 0x00000001
0x10000004: 0x0000000a
0x10000008: 0x00000000
0x1000000c: 0x00000002
0x10000010: 0x0000000a

Current register values : 
-------------------------------------
PC: 0x00400024
Register:
R0: 0x00000000
R1: 0x00000000
R2: 0x00000001
R3: 0x0000000a
R4: 0x10000000
R5: 0x00000000
R6: 0x00000000
R7: 0x00000000
R8: 0x00000000
R9: 0x00000000
R10: 0x00000000
R11: 0x00000000
R12: 0x00000000
R13: 0x00000000
R14: 0x00000000
R15: 0x00000000
R16: 0x00000000
R17: 0x00000000
R18: 0x00000000
R19: 0x00000000
R20: 0x00000000
R21: 0x00000000
R22: 0x00000000
R23: 0x00000000
R24: 0x00000000
R25: 0x00000000
R26: 0x00000000
R27: 0x00000000
R28: 0x00000000
R29: 0x10000004
R30: 0x10000004
R31: 0x00000000

Memory content [0x10000000..0x10000010] :
-------------------------------------
0x10000000: 0x00000001
0x10000004: 0x0000000a
0x10000008: 0x00000000
0x1000000c: 0x00000002
0x10000010: 0x0000000a

Current register values : 
-------------------------------------
PC: 0x00400028
Register:
R0: 0x00000000
R1: 0x00000000
R2: 0x00000001
R3: 0x0000000a
R4: 0x10000000
R5: 0x00000000
R6: 0x00000000
R7: 0x00000000
R8: 0x00000000
R9: 0x00000000
R10: 0x00000000
R11: 0x00000000
R12: 0x00000000
R13: 0x00000000
R14: 0x00000000
R15: 0x00000000
R16: 0x00000000
R17: 0x00000000
R18: 0x00000000
R19: 0x00000000
R20: 0x00000000
R21: 0x00000000
R22: 0x00000000
R23: 0x00000000
R24: 0x00000000
R25: 0x00000000
R26: 0x00000000
R27: 0x00000000
R28: 0x00000000
R29: 0x10000004
R30: 0x10000004
R31: 0x00000000

Memory content [0x10000000..0x10000010] :
-------------------------------------
0x10000000: 0x00000001
0x10000004: 0x0000000a
0x10000008: 0x00000000
0x1000000c: 0x00000002
0x10000010: 0x0000000a

Current register values : 
-------------------------------------
PC: 0x0040002c
Register:
R0: 0x00000000
R1: 0x00000000
R2: 0x00000001
R3: 0x0000000a
R4: 0x10000000
R5: 0x00000000
R6: 0x00000000
R7: 0x00000000
R8: 0x00000000
R9: 0x00000000
R10: 0x00000000
R11: 0x00000000
R12: 0x00000000
R13: 0x00000000
R14: 0x00000000
R15: 0x00000000
R16: 0x00000000
R17: 0x00000000
R18: 0x00000000
R19: 0x00000000
R20: 0x00000000
R21: 0x00000000
R22: 0x00000000
R23: 0x00000000
R24: 0x00000000
R25: 0x00000000
R26: 0x00000000
R27: 0x00000000
R28: 0x00000000
R29: 0x10000004
R30: 0x10000004
R31: 0x00000000

Memory content [0x10000000..0x10000010] :
-------------------------------------
0x10000000: 0x00000001
0x10000004: 0x0000000a
0x10000008: 0x00000000
0x1000000c: 0x00000002
0x10000010: 0x00000001

Current register values : 
-------------------------------------
PC: 0x00400030
Register:
R0: 0x00000000
R1: 0x00000000
R2: 0x00000001
R3: 0x0000000a
R4: 0x10000000
R5: 0x00000000
R6: 0x00000000
R7: 0x00000000
R8: 0x00000000
R9: 0x00000000
R10: 0x00000000
R11: 0x00000000
R12: 0x00000000
R13: 0x00000000
R14: 0x00000000
R15: 0x00000000
R16: 0x00000000
R17: 0x00000000
R18: 0x00000000
R19: 0x00000000
R20: 0x00000000
R21: 0x00000000
R22: 0x00000000
R23: 0x00000000
R24: 0x00000000
R25: 0x00000000
R26: 0x00000000
R27: 0x00000000
R28: 0x00000000
R29: 0x10000004
R30: 0x10000004
R31: 0x00000000

Memory content [0x10000000..0x10000010] :
-------------------------------------
0x10000000: 0x00000001
0x10000004: 0x0000000a
0x10000008: 0x00000000
0x1000000c: 0x00000002
0x10000010: 0x00000001

Current register values : 
-------------------------------------
PC: 0x00400034
Register:
R0: 0x00000000
R1: 0x00000000
R2: 0x00000001
R3: 0x0000000a
R4: 0x10000000
R5: 0x00000000
R6: 0x00000000
R7: 0x00000000
R8: 0x00000000
R9: 0x00000000
R10: 0x00000000
R11: 0x00000000
R12: 0x00000000
R13: 0x00000000
R14: 0x00000000
R15: 0x00000000
R16: 0x00000000
R17: 0x00000000
R18: 0x00000000
R19: 0x00000000
R20: 0x00000000
R21: 0x00000000
R22: 0x00000000
R23: 0x00000000
R24: 0x00000000
R25: 0x00000000
R26: 0x00000000
R27: 0x00000000
R28: 0x00000000
R29: 0x10000004
R30: 0x10000004
R31: 0x00000000

Memory content [0x10000000..0x10000010] :
-------------------------------------
0x10000000: 0x0000000a
0x10000004: 0x0000000a
0x10000008: 0x00000000
0x1000000c: 0x00000002
0x10000010: 0x00000001

Current register values : 
-------------------------------------
PC: 0x00400038
Register:
R0: 0x00000000
R1: 0x00000000
R2: 0x00000001
R3: 0x00000001
R4: 0x10000000
R5: 0x00000000
R6: 0x00000000
R7: 0x00000000
R8: 0x00000000
R9: 0x00000000
R10: 0x00000000
R11: 0x00000000
R12: 0x00000000
R13: 0x00000000
R14: 0x00000000
R15: 0x00000000
R16: 0x00000000
R17: 0x00000000
R18: 0x00000000
R19: 0x00000000
R20: 0x00000000
R21: 0x00000000
R22: 0x00000000
R23: 0x00000000
R24: 0x00000000
R25: 0x00000000
R26: 0x00000000
R27: 0x00000000
R28: 0x00000000
R29: 0x10000004
R30: 0x10000004
R31: 0x00000000

Memory content [0x10000000..0x10000010] :
-------------------------------------
0x10000000: 0x0000000a
0x10000004: 0x0000000a
0x10000008: 0x00000000
0x1000000c: 0x00000002
0x10000010: 0x00000001

Current register values : 
-------------------------------------
PC: 0x0040003c
Register:
R0: 0x00000000
R1: 0x00000000
R2: 0x00000001
R3: 0x00000001
R4: 0x10000000
R5: 0x00000000
R6: 0x00000000
R7: 0x00000000
R8: 0x00000000
R9: 0x00000000
R10: 0x00000000
R11: 0x00000000
R12: 0x00000000
R13: 0x00000000
R14: 0x00000000
R15: 0x00000000
R16: 0x00000000
R17: 0x00000000
R18: 0x00000000
R19: 0x00000000
R20: 0x00000000
R21: 0x00000000
R22: 0x00000000
R23: 0x00000000
R24: 0x00000000
R25: 0x00000000
R26: 0x00000000
R27: 0x00000000
R28: 0x00000000
R29: 0x10000004
R30: 0x10000004
R31: 0x00000000

Memory content [0x10000000..0x10000010] :
-------------------------------------
0x10000000: 0x0000000a
0x10000004: 0x00000001
0x10000008: 0x00000000
0x1000000c: 0x00000002
0x10000010: 0x00000001

Current register values : 
-------------------------------------
PC: 0x00400040
Register:
R0: 0x00000000
R1: 0x00000000
R2: 0x00000002
R3: 0x00000001
R4: 0x10000000
R5: 0x00000000
R6: 0x00000000
R7: 0x00000000
R8: 0x00000000
R9: 0x00000000
R10: 0x00000000
R11: 0x00000000
R12: 0x00000000
R13: 0x00000000
R14: 0x00000000
R15: 0x00000000
R16: 0x00000000
R17: 0x00000000
R18: 0x00000000
R19: 0x00000000
R20: 0x00000000
R21: 0x00000000
R22: 0x00000000
R23: 0x00000000
R24: 0x00000000
R25: 0x00000000
R26: 0x00000000
R27: 0x00000000
R28: 0x00000000
R29: 0x10000004
R30: 0x10000004
R31: 0x00000000

Memory content [0x10000000..0x10000010] :
-------------------------------------
0x10000000: 0x0000000a
0x10000004: 0x00000001
0x10000008: 0x00000000
0x1000000c: 0x00000002
0x10000010: 0x00000001

Current register values : 
-------------------------------------
PC: 0x00400044
Register:
R0: 0x00000000
R1: 0x00000000
R2: 0x00000003
R3: 0x00000001
R4: 0x10000000
R5: 0x00000000
R6: 0x00000000
R7: 0x00000000
R8: 0x00000000
R9: 0x00000000
R10: 0x00000000
R11: 0x00000000
R12: 0x00000000
R13: 0x00000000
R14: 0x00000000
R15: 0x00000000
R16: 0x00000000
R17: 0x00000000
R18: 0x00000000
R19: 0x00000000
R20: 0x00000000
R21: 0x00000000
R22: 0x00000000
R23: 0x00000000
R24: 0x00000000
R25: 0x00000000
R26: 0x00000000
R27: 0x00000000
R28: 0x00000000
R29: 0x10000004
R30: 0x10000004
R31: 0x00000000

Memory content [0x10000000..0x10000010] :
-------------------------------------
0x10000000: 0x0000000a
0x10000004: 0x00000001
0x10000008: 0x00000000
0x1000000c: 0x00000002
0x10000010: 0x00000001

Current register values : 
-------------------------------------
PC: 0x00400048
Register:
R0: 0x00000000
R1: 0x00000000
R2: 0x00000003
R3: 0x00000001
R4: 0x10000000
R5: 0x00000000
R6: 0x00000000
R7: 0x00000000
R8: 0x00000000
R9: 0x00000000
R10: 0x00000000
R11: 0x00000000
R12: 0x00000000
R13: 0x00000000
R14: 0x00000000
R15: 0x00000000
R16: 0x00000000
R17: 0x00000000
R18: 0x00000000
R19: 0x00000000
R20: 0x00000000
R21: 0x00000000
R22: 0x00000000
R23: 0x00000000
R24: 0x00000000
R25: 0x00000000
R26: 0x00000000
R27: 0x00000000
R28: 0x00000000
R29: 0x10000004
R30: 0x10000004
R31: 0x00000000

Memory content [0x10000000..0x10000010] :
-------------------------------------
0x10000000: 0x0000000a
0x10000004: 0x00000001
0x10000008: 0x00000000
0x1000000c: 0x00000003
0x10000010: 0x00000001

Current register values : 
-------------------------------------
PC: 0x00400014
Register:
R0: 0x00000000
R1: 0x00000000
R2: 0x00000003
R3: 0x00000001
R4: 0x10000000
R5: 0x00000000
R6: 0x00000000
R7: 0x00000000
R8: 0x00000000
R9: 0x00000000
R10: 0x00000000
R11: 0x00000000
R12: 0x00000000
R13: 0x00000000
R14: 0x00000000
R15: 0x00000000
R16: 0x00000000
R17: 0x00000000
R18: 0x00000000
R19: 0x00000000
R20: 0x00000000
R21: 0x00000000
R22: 0x00000000
R23: 0x00000000
R24: 0x00000000
R25: 0x00000000
R26: 0x00000000
R27: 0x00000000
R28: 0x00000000
R29: 0x10000004
R30: 0x10000004
R31: 0x00000000

Memory content [0x10000000..0x10000010] :
-------------------------------------
0x10000000: 0x0000000a
0x10000004: 0x00000001
0x10000008: 0x00000000
0x1000000c: 0x00000003
0x10000010: 0x00000001

Current register values : 
-------------------------------------
PC: 0x00400018
Register:
R0: 0x00000000
R1: 0x00000000
R2: 0x00000003
R3: 0x00000001
R4: 0x10000000
R5: 0x00000000
R6: 0x00000000
R7: 0x00000000
R8: 0x00000000
R9: 0x00000000
R10: 0x00000000
R11: 0x00000000
R12: 0x00000000
R13: 0x00000000
R14: 0x00000000
R15: 0x00000000
R16: 0x00000000
R17: 0x00000000
R18: 0x00000000
R19: 0x00000000
R20: 0x00000000
R21: 0x00000000
R22: 0x00000000
R23: 0x00000000
R24: 0x00000000
R25: 0x00000000
R26: 0x00000000
R27: 0x00000000
R28: 0x00000000
R29: 0x10000004
R30: 0x10000004
R31: 0x00000000

Memory content [0x10000000..0x10000010] :
-------------------------------------
0x10000000: 0x0000000a
0x10000004: 0x00000001
0x10000008: 0x00000000
0x1000000c: 0x00000003
0x10000010: 0x00000001

Current register values : 
-------------------------------------
PC: 0x0040001c
Register:
R0: 0x00000000
R1: 0x00000000
R2: 0x00000001
R3: 0x00000001
R4: 0x10000000
R5: 0x00000000
R6: 0x00000000
R7: 0x00000000
R8: 0x00000000
R9: 0x00000000
R10: 0x00000000
R11: 0x00000000
R12: 0x00000000
R13: 0x00000000
R14: 0x00000000
R15: 0x00000000
R16: 0x00000000
R17: 0x00000000
R18: 0x00000000
R19: 0x00000000
R20: 0x00000000
R21: 0x00000000
R22: 0x00000000
R23: 0x00000000
R24: 0x00000000
R25: 0x00000000
R26: 0x00000000
R27: 0x00000000
R28: 0x00000000
R29: 0x10000004
R30: 0x10000004
R31: 0x00000000

Memory content [0x10000000..0x10000010] :
-------------------------------------
0x10000000: 0x0000000a
0x10000004: 0x00000001
0x10000008: 0x00000000
0x1000000c: 0x00000003
0x10000010: 0x00000001

Current register values : 
-------------------------------------
PC: 0x00400020
Register:
R0: 0x00000000
R1: 0x00000000
R2: 0x00000001
R3: 0x00000001
R4: 0x10000000
R5: 0x00000000
R6: 0x00000000
R7: 0x00000000
R8: 0x00000000
R9: 0x00000000
R10: 0x00000000
R11: 0x00000000
R12: 0x00000000
R13: 0x00000000
R14: 0x00000000
R15: 0x00000000
R16: 0x00000000
R17: 0x00000000
R18: 0x00000000
R19: 0x00000000
R20: 0x00000000
R21: 0x00000000
R22: 0x00000000
R23: 0x00000000
R24: 0x00000000
R25: 0x00000000
R26: 0x00000000
R27: 0x00000000
R28: 0x00000000
R29: 0x10000004
R30: 0x10000004
R31: 0x00000000

Memory content [0x10000000..0x10000010] :
-------------------------------------
0x10000000: 0x0000000a
0x10000004: 0x00000001
0x10000008: 0x00000000
0x1000000c: 0x00000003
0x10000010: 0x00000001

